"Tleubayev, A.; Bobojonov, I.; Götz, L.","Tleubayev, Alisher (57218958016); Bobojonov, Ihtiyor (26323550900); Götz, Linde (37066033600)","57218958016; 26323550900; 37066033600","Agricultural Policies and Technical Efficiency of Wheat Production in Kazakhstan and Russia: Evidence from a Stochastic Frontier Approach","2022","Journal of Agricultural and Applied Economics","54","3","","407","421","11","10.1017/aae.2022.13","https://www.scopus.com/inward/record.uri?eid=2-s2.0-85139719797&doi=10.1017%2Faae.2022.13&partnerID=40&md5=7ddb5efe6d6374ef0057c835d1e38feb","Department of Agricultural Markets, Leibniz-Institut für Agrarentwicklung in Transformationsökonomien, Halle, Sachsen-Anhalt, Germany; School of Business, SDU University, Kaskelen, Almaty, Kazakhstan","Tleubayev, Alisher, Department of Agricultural Markets, Leibniz-Institut für Agrarentwicklung in Transformationsökonomien, Halle, Sachsen-Anhalt, Germany, School of Business, SDU University, Kaskelen, Almaty, Kazakhstan; Bobojonov, Ihtiyor, Department of Agricultural Markets, Leibniz-Institut für Agrarentwicklung in Transformationsökonomien, Halle, Sachsen-Anhalt, Germany; Götz, Linde, Department of Agricultural Markets, Leibniz-Institut für Agrarentwicklung in Transformationsökonomien, Halle, Sachsen-Anhalt, Germany","We utilize a unique primary data set of farms in Russia and Kazakhstan to investigate the link between policy reforms and technical efficiency. These countries have heavily subsidized their domestic agricultural production over the last decade, with a total of around USD 76 billion USD and USD 11.5 billion USD in government funding directed towards the agricultural sectors in Russia and Kazakhstan, respectively. Results of a stochastic frontier analysis make evident that variable inputs, such as fertilizer, have a relatively large influence on wheat production compared to land. Nearly every fifth farm has a technical efficiency level lower than 60%, suggesting significant unrealized production potential. While our analysis shows a negative relation between subsidies and efficiency, other factors, such as farmer's education, cooperative and agroholding membership, and participation in insurance programs, are positively related to farm efficiency. The results imply that the governments and policymakers could mobilize the unutilized wheat production potential by improving the farmer education system, fostering cooperation among farms, and developing functioning farm insurance schemes. © 2022 The Author(s). Published by Cambridge University Press on behalf of the Southern Agricultural Economics Association.","Food security; KRU countries; stochastic frontier analysis; subsidies; technical efficiency","","Bundesministerium für Ernährung und Landwirtschaft, BMEL, (2816HS005); Bundesministerium für Ernährung und Landwirtschaft, BMEL","This work was supported by German Federal Ministry of Food and Agriculture (BMEL), in the frame of the research project titled “Analysis of the Strategy of the Russian Federation to extend Agricultural Production (STARLAP)”, Grant Number - 2816HS005.","","","","","","Article","Final","All Open Access; Gold Open Access; Green Accepted Open Access; Green Open Access","Scopus","2-s2.0-85139719797"
"Kadyrov, S.; Orynbassar, A.; Saydaliev, H.B.","Kadyrov, Shirali (36844229300); Orynbassar, Alibek (57220763198); Saydaliev, Hayot Berk (57221252482)","36844229300; 57220763198; 57221252482","Purely Data-driven Exploration of COVID-19 Pandemic After Three Months of the Outbreak","2021","Journal of Mathematical and Fundamental Sciences","53","3","","358","368","0","10.5614/j.math.fund.sci.2021.53.3.2","https://www.scopus.com/inward/record.uri?eid=2-s2.0-85123283208&doi=10.5614%2Fj.math.fund.sci.2021.53.3.2&partnerID=40&md5=3ce0af3b041e465a59c37cb56fd7bc8c","Faculty of Engineering and Natural Sciences, SDU University, Kaskelen, Almaty, Kazakhstan; Faculty of Education and Humanities, SDU University, Kaskelen, Almaty, Kazakhstan; School of Business, SDU University, Kaskelen, Almaty, Kazakhstan; Department of Mathematical Methods in Economics, Tashkent State University of Economics, Tashkent, Uzbekistan","Kadyrov, Shirali, Faculty of Engineering and Natural Sciences, SDU University, Kaskelen, Almaty, Kazakhstan; Orynbassar, Alibek, Faculty of Education and Humanities, SDU University, Kaskelen, Almaty, Kazakhstan; Saydaliev, Hayot Berk, School of Business, SDU University, Kaskelen, Almaty, Kazakhstan, Department of Mathematical Methods in Economics, Tashkent State University of Economics, Tashkent, Uzbekistan","Many research studies have been carried out to understand the epidemiological characteristics of the COVID-19 pandemic in its early phase. The current study is yet another contribution to better understand the disease properties by parameter estimation based on mathematical SIR epidemic modeling. The authors used Johns Hopkins University’s dataset to estimate the basic reproduction number of COVID-19 for five representative countries (Japan, Germany, Italy, France, and the Netherlands) that were selected using cluster analysis. As byproducts, the authors estimated the transmission, recovery, and death rates for each selected country and carried out statistical tests to see if there were any significant differences. © 2021.","Basic reproduction; Clustering; COVID-19; Doubling period; Dynamical systems; Parameter estimation; SIR model","","","","","","","","","Article","Final","All Open Access; Gold Open Access; Green Accepted Open Access; Green Open Access","Scopus","2-s2.0-85123283208"
"Yegorov, S.; Bromage, S.; Boldbaatar, N.; Ganmaa, D.","Yegorov, Sergey (26434035900); Bromage, Sabri (57191191130); Boldbaatar, Ninjin (57194383595); Ganmaa, Davaasambuu (6507193376)","26434035900; 57191191130; 57194383595; 6507193376","Effects of Vitamin D Supplementation and Seasonality on Circulating Cytokines in Adolescents: Analysis of Data From a Feasibility Trial in Mongolia","2019","Frontiers in Nutrition","6","","166","","","14","10.3389/fnut.2019.00166","https://www.scopus.com/inward/record.uri?eid=2-s2.0-85074666073&doi=10.3389%2Ffnut.2019.00166&partnerID=40&md5=9c0f561260f9d521bb5025f4ce4cf8de","Department of Mathematics and Natural Sciences, SDU University, Kaskelen, Almaty, Kazakhstan; Department of Biology, Nazarbayev University, Astana, Kazakhstan; Department of Nutrition, Harvard T.H. Chan School of Public Health, Boston, MA, United States; Department of Radiation Oncology, Brigham and Women's Hospital, Boston, MA, United States; Harvard Medical School, Boston, MA, United States","Yegorov, Sergey, Department of Mathematics and Natural Sciences, SDU University, Kaskelen, Almaty, Kazakhstan, Department of Biology, Nazarbayev University, Astana, Kazakhstan; Bromage, Sabri, Department of Nutrition, Harvard T.H. Chan School of Public Health, Boston, MA, United States; Boldbaatar, Ninjin, Department of Radiation Oncology, Brigham and Women's Hospital, Boston, MA, United States; Ganmaa, Davaasambuu, Department of Nutrition, Harvard T.H. Chan School of Public Health, Boston, MA, United States, Harvard Medical School, Boston, MA, United States","Vitamin D deficiency is prevalent in human populations and has been linked to immune dysfunction. Here we explored the effects of cholecalciferol supplementation on circulating cytokines in severely vitamin D deficient [blood 25(OH)D << 30 nmol/L] adolescents aged 12–15 from Mongolia. The study included 28 children receiving 800 IU daily cholecalciferol for 6 months spanning winter and spring, and 30 children receiving placebo during the same period. The levels of 25(OH)D were assessed at baseline, 3 and 6 months. Twenty-one cytokines were measured in serum at baseline and at 6 months. Changes in 25(OH)D and cytokines were assessed using paired parametric tests. The median blood 25(OH)D concentration at baseline was 13.7 nmol/L (IQR = 10.0–21.7). Supplementation tripled blood 25(OH)D levels (p < 0.001) and was associated with elevated interleukin (IL)-6 (p = 0.043). The placebo group had reduced macrophage inflammatory protein (MIP)-1α (p = 0.007) and IL-8 (p = 0.034) at 6 months. Although limited by a small sample size, these findings suggest that cholecalciferol supplementation and seasonality may impact systemic immunity in adolescents, identifying chemokines as potentially important biomarkers of vitamin D status in this Northeast Asian population. Larger clinical trials are warranted to validate these results. Clinical Trial Registration: www.ClinicalTrial.org, Identifier: NCT01244204. © Copyright © 2019 Yegorov, Bromage, Boldbaatar and Ganmaa.","adolescents; chemokines; cholecalciferol supplementation; cytokines; Mongolia; Northeast Asia; vitamin D deficiency","","National Institutes of Health, NIH; National Heart, Lung, and Blood Institute, NHLBI, (1K99HL089710-01A1)","This study was supported by the NIH/NHLBI 1K99HL089710-01A1 grant to DG. We acknowledge the support of Harvard Catalyst—Laboratory for Innovative Translational Technologies (HC-LITT) at Harvard Institutes of Medicine with cytokine assays.","","","","","","Article","Final","All Open Access; Gold Open Access; Green Accepted Open Access; Green Open Access","Scopus","2-s2.0-85074666073"
"Ospanova, A.; Anuarova, L.; Spanbayev, A.; Tulegenova, Z.; Yechshzhanov, T.; Shapalov, S.; Gabdulkhayeva, B.; Zhumabekova, B.; Kabieva, S.; Baidalinova, B.","Ospanova, Ainagul K. (57193138620); Anuarova, Lyailya Ermekhanovna (56127325300); Spanbayev, Aidar D. (35723200800); Tulegenova, Zhanar (35723112200); Yechshzhanov, Talgat (57194064895); Shapalov, Shermakhan K. (57190003460); Gabdulkhayeva, Bakytzhamal (57200313455); Zhumabekova, Bibigul (57200316620); Kabieva, Saltanat Zhumabaevna (56016939200); Baidalinova, Bibenur Askarovna (56017302900)","57193138620; 56127325300; 35723200800; 35723112200; 57194064895; 57190003460; 57200313455; 57200316620; 56016939200; 56017302900","Cytospora cankers on tree plants in urban areas (Karaganda, Astana, Pavlodar) of central and northern Kazakhstan","2018","Ekoloji","27","106","","63","69","8","","https://www.scopus.com/inward/record.uri?eid=2-s2.0-85058188268&partnerID=40&md5=bc065a2efafe149b44e28c03d16c56dd","Innovative University of Eurasia, Pavlodar, Pavlodar, Kazakhstan; Kazakh National Women‘s Teacher Training University, Almaty, Kazakhstan; L.N. Gumilyov Eurasian National University, Astana, Kazakhstan; SDU University, Kaskelen, Almaty, Kazakhstan; Zhanibekov University, Shymkent, Kazakhstan; Pavlodar Pedagogical University, Pavlodar, Pavlodar oblast, Kazakhstan","Ospanova, Ainagul K., Innovative University of Eurasia, Pavlodar, Pavlodar, Kazakhstan; Anuarova, Lyailya Ermekhanovna, Kazakh National Women‘s Teacher Training University, Almaty, Kazakhstan; Spanbayev, Aidar D., L.N. Gumilyov Eurasian National University, Astana, Kazakhstan; Tulegenova, Zhanar, L.N. Gumilyov Eurasian National University, Astana, Kazakhstan; Yechshzhanov, Talgat, SDU University, Kaskelen, Almaty, Kazakhstan; Shapalov, Shermakhan K., Zhanibekov University, Shymkent, Kazakhstan; Gabdulkhayeva, Bakytzhamal, Pavlodar Pedagogical University, Pavlodar, Pavlodar oblast, Kazakhstan; Zhumabekova, Bibigul, Pavlodar Pedagogical University, Pavlodar, Pavlodar oblast, Kazakhstan; Kabieva, Saltanat Zhumabaevna, Pavlodar Pedagogical University, Pavlodar, Pavlodar oblast, Kazakhstan; Baidalinova, Bibenur Askarovna, Pavlodar Pedagogical University, Pavlodar, Pavlodar oblast, Kazakhstan","Cytospora canker is a serious fungal disease attacking many types of fruit and ornamental trees in urban parks and gardens. This factor is important when it comes to identifying the disease, as well as to studying its distribution and determining the best methods for its control. The purpose of this article is to define the species composition, host plants, seasonal dynamics of Cytospora cankers on tree plants in major cities of Central and Northern Kazakhstan (Karaganda, Astana and Pavlodar). 5 Cytospora species were recorded on leaves and bark of the examined trees during the research: Cytospora leucosperma (Pers.) Fr. on Betula pendula L., Cytospora microspora (Corda) Rabenh. on Crataegus sanguinea Pall., Cytospora salicis on Salix fragilis L., Cytospora salicis (Cda.) Rad. on Populus nigra L. and Cytospora pseudoplatani Sacc. on Acer negundo L. Cytospora species development turned to be dependent on the amount of precipitations and was slightly affected by temperature. Cytospora salicis (Сda.) Rad on Populus nigra L. and Cytospora leucosperma (Pers.) Fr on Betula pendula L. were new species for Kazakhstan. Cytospora salicis (Cda.) Rad, that parasitizes on the Populus nigra L. appeared the most hazardous specie. © Foundation Environmental Protection & Research-FEPR.","Cytospora cankers; Endophytic pathogens; Fungal disease; Host plants; Stroma","community composition; deciduous tree; endophyte; fungal disease; host plant; new species; pathogen; precipitation (climatology); seasonal variation; tree; urban area; Astana; Kazakhstan; Pavlodar; Acer negundo; Betula pendula; Crataegus sanguinea; Cytospora; Populus nigra; Salix fragilis; Valsa ambiens subsp. ambiens","","","","","","","","Article","Final","","Scopus","2-s2.0-85058188268"
"Katsanevakis, S.; Acar, Ü.; Ammar, I.; Balci, B.A.; Bekas, P.; Belmonte, M.; Chintiroglou, C.C.; Consoli, P.; Dimiza, M.; Fryganiotis, K.; Gerovasileiou, V.; Gnisci, V.; Gülşahin, N.; Hoffman, R.; Issaris, Y.; Izquierdo-Gomez, D.; Izquierdo-Muñoz, A.; Kavadas, S.; Koehler, L.; Konstantinidis, E.; Mazza, G.; Nowell, G.; Önal, U.; Özen, M.R.; Pafilis, P.; Pastore, M.; Perdikaris, C.; Poursanidis, D.; Prato, E.; Russo, F.; Sicuro, B.; Tarkan, A.N.; Thessalou-Legaki, M.; Tiralongo, F.; Triantaphyllou, M.; Tsiamis, K.; Tunçer, S.; Turan, C.; Türker, A.; Yapici, S.","Katsanevakis, Stelios (55879579300); Acar, Ümit (55866023400); Ammar, Izdihar Ali (56723781500); Balci, Beytullah Ahmet (36150362600); Bekas, Petros (6506979586); Belmonte, M. (35749429500); Chintiroglou, Chariton Charles (35568823500); Consoli, Pierpaolo (22933457800); Dimiza, Margarita D. (6505772220); Fryganiotis, Kostantinos (37661197200); Gerovasileiou, Vasilis (55313619300); Gnisci, Valentina (55927690400); Gülşahin, Nurçin (53879658800); Hoffman, Razy (25931678000); Issaris, Yiannis (36084293400); Izquierdo-Gomez, David (55441290500); Izquierdo-Muñoz, Andrés (55314389800); Kavadas, Stefanos (15826621400); Koehler, Lydia (57200247200); Konstantinidis, Evangelos (55188774200); Mazza, Gianfranco (57224717505); Nowell, G. (59845641700); Önal, Umur (6506221116); Özen, Mehmet Rüştü (15074318000); Pafilis, Panayiotis (8982480100); Pastore, Michele A. (7006409077); Perdikaris, Costas (18537206800); Poursanidis, Dimitris (36085250400); Prato, Ermelinda (9839178800); Russo, Fabio (56723532600); Sicuro, Benedetto (12807840400); Tarkan, Ahmet Nuri (16176758900); Thessalou-Legaki, Maria (6602591774); Tiralongo, Francesco (58976962400); Triantaphyllou, M. V. (6601982150); Tsiamis, Konstantinos (6506463175); Tunçer, Sezginer (26028993000); Turan, Cemal (7006237943); Türker, Ali (56346875900); Yapici, Sercan (36639049200)","55879579300; 55866023400; 56723781500; 36150362600; 6506979586; 35749429500; 35568823500; 22933457800; 6505772220; 37661197200; 55313619300; 55927690400; 53879658800; 25931678000; 36084293400; 55441290500; 55314389800; 15826621400; 57200247200; 55188774200; 57224717505; 59845641700; 6506221116; 15074318000; 8982480100; 7006409077; 18537206800; 36085250400; 9839178800; 56723532600; 12807840400; 16176758900; 6602591774; 58976962400; 6601982150; 6506463175; 26028993000; 7006237943; 56346875900; 36639049200","New Mediterranean Biodiversity Records (October, 2014)","2014","Mediterranean Marine Science","15","3","","675","695","72","10.12681/mms.1123","https://www.scopus.com/inward/record.uri?eid=2-s2.0-84924910750&doi=10.12681%2Fmms.1123&partnerID=40&md5=ef5de5a7ec0bf71d4241be6fafa688cb","Department of Marine Sciences, University of the Aegean, Mytilene, North Aegean, Greece; Faculty of Fisheries, Muğla Sıtkı Koçman Üniversitesi, Mugla, Mugla, Turkey; High Institute of Marine Research, Université Tichrine, Latakia, Syrian Arab Republic; Fisheries Faculty, Akdeniz Üniversitesi, Antalya, Turkey; Institute of Marine Biological Resources and Inland Waters, Hellenic Centre for Marine Research, Anavyssos, Attica, Greece; 'Istituto per l'Ambiente Marino Costiero del Consiglio Nazionale delle Ricerche (IAMC-CNR), Naples, FL, Italy; Department of Zoology, School of Biology, Thessaloniki, Central Macedonia, Greece; Italian Institute for Environmental Protection and Research, Rome, RM, Italy; Faculty of Geology and Geoenvironment, National and Kapodistrian University of Athens, Athens, Attica, Greece; Laboratory of Experimental Oceanology and Marine Ecology, Università degli Studi della Tuscia Viterbo, Viterbo, VT, Italy; Department of Molecular Biology and Ecology of Plants, Tel Aviv University, Tel Aviv-Yafo, Tel Aviv District, Israel; Institute of Marine Biology, Hellenic Centre for Marine Research, Anavyssos, Attica, Greece; Departamento de Ciencias del Mar y Biología Aplicada, Universitat d'Alacant, Alicante, Alicante, Spain; Centro de Investigación Marina de Santa Pola (CIMAR), Universitat d'Alacant, Alicante, Alicante, Spain; Faculty of Law, L-Università ta' Malta, Msida, Malta; Consorzio Plemmirio, Siracusa, Italy; Faculty of Marine Sciences and Technology, Çanakkale Onsekiz Mart Üniversitesi, Canakkale, Canakkale, Turkey; SDU University, Kaskelen, Almaty, Kazakhstan; Department of Biology, National and Kapodistrian University of Athens, Athens, Attica, Greece; Institute of Applied and Computational Mathematics, Foundation for Research and Technology-Hellas, Heraklion, Crete, Greece; Ente Fauna Marina Mediterranea - Sede Campana, Napoli, Italy; Department of Veterinary Clinical Sciences, Università degli Studi di Torino, Turin, TO, Italy; Institute of Oceanography, Hellenic Centre for Marine Research, Anavyssos, Attica, Greece; Faculty of Fisheries, Mustafa Kemal Üniversitesi, Antakya, Turkey","Katsanevakis, Stelios, Department of Marine Sciences, University of the Aegean, Mytilene, North Aegean, Greece; Acar, Ümit, Faculty of Fisheries, Muğla Sıtkı Koçman Üniversitesi, Mugla, Mugla, Turkey; Ammar, Izdihar Ali, High Institute of Marine Research, Université Tichrine, Latakia, Syrian Arab Republic; Balci, Beytullah Ahmet, Fisheries Faculty, Akdeniz Üniversitesi, Antalya, Turkey; Bekas, Petros, Institute of Marine Biological Resources and Inland Waters, Hellenic Centre for Marine Research, Anavyssos, Attica, Greece; Belmonte, M., 'Istituto per l'Ambiente Marino Costiero del Consiglio Nazionale delle Ricerche (IAMC-CNR), Naples, FL, Italy; Chintiroglou, Chariton Charles, Department of Zoology, School of Biology, Thessaloniki, Central Macedonia, Greece; Consoli, Pierpaolo, Italian Institute for Environmental Protection and Research, Rome, RM, Italy; Dimiza, Margarita D., Faculty of Geology and Geoenvironment, National and Kapodistrian University of Athens, Athens, Attica, Greece; Fryganiotis, Kostantinos, Department of Zoology, School of Biology, Thessaloniki, Central Macedonia, Greece; Gerovasileiou, Vasilis, Department of Zoology, School of Biology, Thessaloniki, Central Macedonia, Greece; Gnisci, Valentina, Laboratory of Experimental Oceanology and Marine Ecology, Università degli Studi della Tuscia Viterbo, Viterbo, VT, Italy; Gülşahin, Nurçin, Faculty of Fisheries, Muğla Sıtkı Koçman Üniversitesi, Mugla, Mugla, Turkey; Hoffman, Razy, Department of Molecular Biology and Ecology of Plants, Tel Aviv University, Tel Aviv-Yafo, Tel Aviv District, Israel; Issaris, Yiannis, Institute of Marine Biology, Hellenic Centre for Marine Research, Anavyssos, Attica, Greece; Izquierdo-Gomez, David, Departamento de Ciencias del Mar y Biología Aplicada, Universitat d'Alacant, Alicante, Alicante, Spain; Izquierdo-Muñoz, Andrés, Centro de Investigación Marina de Santa Pola (CIMAR), Universitat d'Alacant, Alicante, Alicante, Spain; Kavadas, Stefanos, Institute of Marine Biological Resources and Inland Waters, Hellenic Centre for Marine Research, Anavyssos, Attica, Greece; Koehler, Lydia, Faculty of Law, L-Università ta' Malta, Msida, Malta; Konstantinidis, Evangelos, Consorzio Plemmirio, Siracusa, Italy; Mazza, Gianfranco, Faculty of Marine Sciences and Technology, Çanakkale Onsekiz Mart Üniversitesi, Canakkale, Canakkale, Turkey; Nowell, G., SDU University, Kaskelen, Almaty, Kazakhstan; Önal, Umur, Department of Biology, National and Kapodistrian University of Athens, Athens, Attica, Greece; Özen, Mehmet Rüştü, Institute of Applied and Computational Mathematics, Foundation for Research and Technology-Hellas, Heraklion, Crete, Greece; Pafilis, Panayiotis, Ente Fauna Marina Mediterranea - Sede Campana, Napoli, Italy; Pastore, Michele A., 'Istituto per l'Ambiente Marino Costiero del Consiglio Nazionale delle Ricerche (IAMC-CNR), Naples, FL, Italy; Perdikaris, Costas, Consorzio Plemmirio, Siracusa, Italy; Poursanidis, Dimitris, Department of Marine Sciences, University of the Aegean, Mytilene, North Aegean, Greece, Department of Veterinary Clinical Sciences, Università degli Studi di Torino, Turin, TO, Italy; Prato, Ermelinda, 'Istituto per l'Ambiente Marino Costiero del Consiglio Nazionale delle Ricerche (IAMC-CNR), Naples, FL, Italy; Russo, Fabio, Institute of Oceanography, Hellenic Centre for Marine Research, Anavyssos, Attica, Greece; Sicuro, Benedetto, Faculty of Fisheries, Mustafa Kemal Üniversitesi, Antakya, Turkey; Tarkan, Ahmet Nuri, Faculty of Fisheries, Muğla Sıtkı Koçman Üniversitesi, Mugla, Mugla, Turkey; Thessalou-Legaki, Maria, Ente Fauna Marina Mediterranea - Sede Campana, Napoli, Italy; Tiralongo, Francesco, Laboratory of Experimental Oceanology and Marine Ecology, Università degli Studi della Tuscia Viterbo, Viterbo, VT, Italy; Triantaphyllou, M. V., Faculty of Geology and Geoenvironment, National and Kapodistrian University of Athens, Athens, Attica, Greece; Tsiamis, Konstantinos, ; Tunçer, Sezginer, Department of Biology, National and Kapodistrian University of Athens, Athens, Attica, Greece; Turan, Cemal, ; Türker, Ali, Faculty of Fisheries, Muğla Sıtkı Koçman Üniversitesi, Mugla, Mugla, Turkey; Yapici, Sercan, Faculty of Fisheries, Muğla Sıtkı Koçman Üniversitesi, Mugla, Mugla, Turkey","The Collective Article 'New Mediterranean Biodiversity Records' of the Mediterranean Marine Science journal offers the means to publish biodiversity records in the Mediterranean Sea. The current article is divided in two parts, for records of alien and native species respectively. The new records of alien species include: the red alga Asparagopsis taxiformis (Crete and Lakonikos Gulf, Greece); the red alga Grateloupia turuturu (along the Israeli Mediterranean shore); the mantis shrimp Clorida albolitura (Gulf of Antalya, Turkey); the mud crab Dyspanopeus sayi (Mar Piccolo of Taranto, Ionian Sea); the blue crab Callinectes sapidus (Chios Island, Greece); the isopod Paracerceis sculpta (northern Aegean Sea, Greece); the sea urchin Diadema setosum (Gökova Bay, Turkey); the molluscs Smaragdia souverbiana, Murex forskoehlii, Fusinus verrucosus, Circenita callipyga, and Aplysia dactylomela (Syria); the cephalaspidean mollusc Haminoea cyanomarginata (Baia di Puolo, Massa Lubrense, Campania, southern Italy); the topmouth gudgeon Pseudorasbora parva (Civitavecchia, Tyrrhenian Sea); the fangtooth moray Enchelycore anatina (Plemmirio marine reserve, Sicily); the silver-cheeked toadfish Lagocephalus sceleratus (Saros Bay, Turkey; and Ibiza channel, Spain); the Indo-Pacific ascidian Herdmania momus in Kastelorizo Island (Greece); and the foraminiferal Clavulina multicamerata (Saronikos Gulf, Greece). The record of L. sceleratus in Spain consists the deepest (350-400m depth) record of the species in the Mediterranean Sea. The new records of native species include: first record of the ctenophore Cestum veneris in Turkish marine waters; the presence of Holothuria tubulosa and Holothuria polii in the Bay of Igoumenitsa (Greece); the first recorded sighting of the bull ray Pteromylaeus bovinus in Maltese waters; and a new record of the fish Lobotes surinamensis from Maliakos Gulf.","","","","","","","","","","Article","Final","All Open Access; Gold Open Access; Green Accepted Open Access; Green Open Access","Scopus","2-s2.0-84924910750"
