"Автор (ы)","Author full names","Идентификатор автора(ов)","Название документа","Год","Название источника","Том","Выпуск","Статья №","Страница начала","Страница окончания","Цитирования","DOI","Ссылка","Организации","Авторы организаций","Краткое описание","Ключевые слова автора","Ключевые слова указателя","Сведения о финансировании","Текст о финансировании","Спонсоры","Название конференции","Дата конференции","Место проведения конференции","Код конференции","Тип документа","СТАДИЯ ПУБЛИКАЦИИ","Open Access (открытый доступ)","Источник","EID"
"Shevchenko, Y.; Bakranov, N.; Serikkanov, A.; Bakranova, D.","Shevchenko, Ye (60353601900); Bakranov, Nurlan B. (56122094300); Serikkanov, A. S. (6508321334); Bakranova, Dina I. (57189357367)","60353601900; 56122094300; 6508321334; 57189357367","Photoelectrochemical pathways to green hydrogen. analysis, overview, and foresight","2026","Renewable and Sustainable Energy Reviews","231","","116753","","","0","10.1016/j.rser.2026.116753","https://www.scopus.com/inward/record.uri?eid=2-s2.0-105028789390&doi=10.1016%2Fj.rser.2026.116753&partnerID=40&md5=32cc5727dc557b1a815755ad98920971","National Academy of Science of Kazakhstan, Almaty, Kazakhstan; Research Group altAir Nanolab LLP, Almaty, Almaty, Kazakhstan; SDU University, Kaskelen, Almaty, Kazakhstan","Shevchenko, Ye, National Academy of Science of Kazakhstan, Almaty, Kazakhstan; Bakranov, Nurlan B., National Academy of Science of Kazakhstan, Almaty, Kazakhstan, Research Group altAir Nanolab LLP, Almaty, Almaty, Kazakhstan; Serikkanov, A. S., National Academy of Science of Kazakhstan, Almaty, Kazakhstan; Bakranova, Dina I., SDU University, Kaskelen, Almaty, Kazakhstan","Photoelectrochemical (PEC) water splitting represents a promising pathway for sustainable hydrogen production by directly converting solar energy into chemical fuel within a single integrated system. Despite decades of intensive research on semiconductor photoelectrodes, PEC technologies remain largely confined to laboratory-scale demonstrations due to limited solar-to-hydrogen efficiency, insufficient operational stability, and challenges related to scalability and system integration. This review provides a critical and technology-oriented synthesis of recent advances in PEC hydrogen generation, focusing on material platforms, device architectures, and modification strategies that govern performance and durability. Emphasis is placed on oxide, nitride, chalcogenide, and hybrid photoelectrode systems, alongside interface engineering approaches such as heterojunction formation, defect and vacancy control, surface passivation, and cocatalyst integration. Beyond materials-level considerations, the analysis situates PEC water splitting within a broader technoeconomic and system context, addressing cost drivers, integration with variable renewable energy supply, and infrastructure constraints. Drawing on representative academic results and patent-informed technological developments, the review identifies key bottlenecks limiting practical deployment and highlights pathways for translating laboratory advances toward demonstrator-scale systems. On this basis, a foresight-oriented roadmap extending to 2035 is proposed, outlining strategic milestones in efficiency, stability, system integration, and policy alignment required for PEC water splitting to emerge as a viable contributor to the future hydrogen economy. © 2026 The Authors","Foresight analysis; Green hydrogen; Hydrogen energy; Materials innovation; PEC devices; Photoelectrochemical (PEC) water splitting; Solar-to-hydrogen (STH) efficiency","Cost benefit analysis; Economics; Efficiency; Hydrogen economy; Hydrogen fuels; Hydrogen production; Integrated control; Integration; Passivation; Patents and inventions; Photoelectrochemical cells; Solar energy; Solar power generation; Foresight analyze; Green hydrogen; Hydrogen Energy; Materials innovations; Photoelectrochemical devices; Photoelectrochemical water splitting; Photoelectrochemicals; Solar-to-hydrogen; Solar-to-hydrogen efficiency; System integration; Heterojunctions","Ministry of Education and Science of the Republic of Kazakhstan, (AP23490626); Ministry of Education and Science of the Republic of Kazakhstan","The author(s) declare that financial support was received for the authorship, and/or publication of this articleby the National Academy of Sciences of Kazakhstan under the President of the Republic of Kazakhstan, and for the research study by the Science Committee of the Ministry of Higher Education and Science of the Republic of Kazakhstan (Grant No. AP23490626 \u201CResearch and development of ZnO/BiVO 4 and Cu 2 O/ZnO photoelectrodes to create highly efficient tandem light-driven hydrogen production systems\u201D).","","","","","","Review","Final","All Open Access; Hybrid Gold Open Access","Scopus","2-s2.0-105028789390"
"Daurenova, I.; Mustafayeva, A.; KHAZIMOV, K.; Garbati Pegna, F.; Khazimov, M.","Daurenova, Indira (59226221400); Mustafayeva, Ardak (57223220335); KHAZIMOV, Kanat M. (56469755000); Garbati Pegna, Francesco (27967961600); Khazimov, M. Zh (55212169200)","59226221400; 57223220335; 56469755000; 27967961600; 55212169200","Bee Bread Granule Drying in a Solar Dryer with Mobile Shelves","2025","Energies","18","20","5472","","","1","10.3390/en18205472","https://www.scopus.com/inward/record.uri?eid=2-s2.0-105020239415&doi=10.3390%2Fen18205472&partnerID=40&md5=10e71c5f107e9b992986fa05e22fec27","Faculty of Engineering, Kazakh National Agrarian Research University, Almaty, Kazakhstan; Institute of Energy and Green Technologies, Almaty University of Power Engineering and Telecommunications, Almaty, Almaty Province, Kazakhstan; School of Applied Mathematics, Kazakh-British Technical University, Almaty, Kazakhstan; Department of Information Systems, SDU University, Kaskelen, Almaty, Kazakhstan; Department of Agriculture, Università degli Studi di Firenze, Florence, FI, Italy","Daurenova, Indira, Faculty of Engineering, Kazakh National Agrarian Research University, Almaty, Kazakhstan, Institute of Energy and Green Technologies, Almaty University of Power Engineering and Telecommunications, Almaty, Almaty Province, Kazakhstan; Mustafayeva, Ardak, School of Applied Mathematics, Kazakh-British Technical University, Almaty, Kazakhstan; KHAZIMOV, Kanat M., Faculty of Engineering, Kazakh National Agrarian Research University, Almaty, Kazakhstan, Department of Information Systems, SDU University, Kaskelen, Almaty, Kazakhstan; Garbati Pegna, Francesco, Department of Agriculture, Università degli Studi di Firenze, Florence, FI, Italy; Khazimov, M. Zh, Faculty of Engineering, Kazakh National Agrarian Research University, Almaty, Kazakhstan, Institute of Energy and Green Technologies, Almaty University of Power Engineering and Telecommunications, Almaty, Almaty Province, Kazakhstan","This paper presents the development and evaluation of an autonomous solar dryer designed to enhance the drying efficiency of bee bread granules. In contrast to natural open-air drying, the proposed system utilizes solar energy in an oscillating operational mode to achieve a controlled and accelerated drying process. The dryer comprises a solar collector integrated into the base of the drying chamber, which facilitates convective heating of the drying agent (air). The system is further equipped with a photovoltaic panel to generate electricity for powering and controlling the operation of air extraction fans. The methodology combines numerical modeling with experimental studies, structured by an experimental design framework. The modeling component simulates variations in temperature (288–315 K) and relative humidity within a layer of bee bread granules subjected to a convective air flow. The numerical simulation enabled the determination of the following: the time required to achieve a stationary operating mode in the dryer chamber (20 min); and the rate of change in moisture content within the granule layer during conventional drying (18 h) and solar drying treatment (6 h). The experimental investigations focused on determining the effects of granule mass, air flow rate, and drying time on the moisture content and temperature of the granular layer of Bee Bread. A statistically grounded analysis, based on the design of experiments (DoE), demonstrated a reduction in moisture content from an initial 16.2–18.26% to a final 11.1–12.1% under optimized conditions. Linear regression models were developed to describe the dependencies for both natural and forced convection drying. A comparative evaluation using enthalpy–humidity (I-d) diagrams revealed a notable improvement in the drying efficiency of the proposed method compared to natural drying. This enhanced performance is attributed to the system’s intermittent operational mode and its ability to actively remove moist air. The results confirm the potential of the developed system for sustainable and energy-efficient drying of bee bread granules in remote areas with limited access to a conventional power grid. © 2025 by the authors.","ANSYS Fluent; bee bread granule; bee products; Python; shelving; solar dryer; solar energy; temperature","Air; Computer aided software engineering; Computer software; Design of experiments; Drying; Energy efficiency; Granular materials; Granulation; Moisture; Moisture determination; Numerical models; Product design; Regression analysis; Solar heating; Solar power generation; %moisture; Air drying; ANSYS fluent; Bee bread granule; Bee product; Drying efficiency; Energy; Fluents; Operational modes; Shelving; Solar dryers; Solar energy","Ministry of Education and Science of the Republic of Kazakhstan, (AP19679448)","The Committee of Science of the Ministry of Science and Higher Education of the Republic of Kazakhstan (No. AP19679448) have funded this research.","","","","","","Article","Final","All Open Access; Gold Open Access; Green Accepted Open Access; Green Open Access","Scopus","2-s2.0-105020239415"
"Abeuov, N.; Absatov, D.; Mutaliyev, Y.; Serek, A.","Abeuov, Nurmukhamed (58522743000); Absatov, Daniyar (60169744300); Mutaliyev, Yelnur (60169744400); Serek, Azamat (57207763595)","58522743000; 60169744300; 60169744400; 57207763595","Accurate Crowd Counting Using an Enhanced LCDANet with Multi-Scale Attention Modules","2025","Buletin Ilmiah Sarjana Teknik Elektro","7","3","","657","667","0","10.12928/biste.v7i3.14391","https://www.scopus.com/inward/record.uri?eid=2-s2.0-105021012249&doi=10.12928%2Fbiste.v7i3.14391&partnerID=40&md5=0967c836daf7079a47c86ed565d21eeb","School of Information Technology and Engineering, Kazakh-British Technical University, Almaty, Kazakhstan; Satbayev University, Almaty, Kazakhstan; School of Digital Technologies, Narxoz University, Almaty, Kazakhstan; Department of Computer Science, SDU University, Kaskelen, Almaty, Kazakhstan","Abeuov, Nurmukhamed, School of Information Technology and Engineering, Kazakh-British Technical University, Almaty, Kazakhstan; Absatov, Daniyar, School of Information Technology and Engineering, Kazakh-British Technical University, Almaty, Kazakhstan; Mutaliyev, Yelnur, Satbayev University, Almaty, Kazakhstan, Department of Computer Science, SDU University, Kaskelen, Almaty, Kazakhstan; Serek, Azamat, School of Information Technology and Engineering, Kazakh-British Technical University, Almaty, Kazakhstan, School of Digital Technologies, Narxoz University, Almaty, Kazakhstan","Accurate crowd counting remains a challenging task due to occlusion, scale variation, and complex scene layouts. This study proposes ME-LCDANet, an enhanced deep learning framework built upon the LCDANet backbone, integrating multi-scale feature extraction via Micro Atrous Spatial Pyramid Pooling (MicroASPP) and attention refinement using CBAMLite modules. A preprocessing pipeline with Gaussian-based density maps, synchronized augmentations, and a dual-objective loss function combining density and count supervision supports effective training and generalization. Experimental evaluation on the ShanghaiTech Part B dataset demonstrates a Mean Absolute Error (MAE) of 11.50 (95% CI: 10.20–12.91) and a Root Mean Squared Error (RMSE) of 11.54 (95% CI: 10.26–12.99). Training dynamics indicate steadily declining loss and reduced validation MAE, while gradient norm analysis suggests reliable convergence. Comparative results show that, although CSRNet and SaNet achieve slightly lower MAE, ME-LCDANet attains a notably reduced RMSE, reflecting robustness against large prediction deviations. While the study focuses on a single benchmark dataset, the proposed architecture offers a promising approach for robust crowd counting in diverse scenarios. © 2025, Universitas Ahmad Dahlan. All rights reserved.","Attention Mechanismss; Crowd Counting; Density Estimation; Inference of Crowd; MicroASPP","","","","","","","","","Article","Final","","Scopus","2-s2.0-105021012249"
"Baktibayev, D.; Serek, A.; Berlikozha, B.; Rustauletov, B.","Baktibayev, Daulet (59233034800); Serek, Azamat (57207763595); Berlikozha, Bauyrzhan (59702974900); Rustauletov, Babur (60153055800)","59233034800; 57207763595; 59702974900; 60153055800","Resource-efficient Sentiment Classification of App Reviews Using a CNN-BiLSTM Hybrid Model","2025","Buletin Ilmiah Sarjana Teknik Elektro","7","3","","427","433","1","10.12928/biste.v7i3.13954","https://www.scopus.com/inward/record.uri?eid=2-s2.0-105019513933&doi=10.12928%2Fbiste.v7i3.13954&partnerID=40&md5=2b2604b6177c71b60c62319dd6d5e0a6","School of Information Technology and Engineering, Kazakh-British Technical University, Almaty, Kazakhstan; School of Digital Technologies, Narxoz University, Almaty, Kazakhstan; Department of Information Systems, SDU University, Kaskelen, Almaty, Kazakhstan","Baktibayev, Daulet, School of Information Technology and Engineering, Kazakh-British Technical University, Almaty, Kazakhstan; Serek, Azamat, School of Information Technology and Engineering, Kazakh-British Technical University, Almaty, Kazakhstan, School of Digital Technologies, Narxoz University, Almaty, Kazakhstan; Berlikozha, Bauyrzhan, Department of Information Systems, SDU University, Kaskelen, Almaty, Kazakhstan; Rustauletov, Babur, Department of Information Systems, SDU University, Kaskelen, Almaty, Kazakhstan","This study evaluates the performance of a hybrid convolutional neural network and bidirectional long short-term memory (CNN + BiLSTM) model for sentiment classification on user reviews from the Spotify mobile application. The primary aim is to explore whether competitive results can be achieved without relying on transformer-based architectures, which often require substantial computational resources. The proposed CNN + BiLSTM model combines local feature extraction with sequential context modeling and is benchmarked against traditional machine learning and simpler deep learning models, including a Random Forest classifier enhanced with polarity features, a standalone CNN, and a fully connected DNN. Sentiment labels were binary (positive or negative) and directly provided in the dataset without being inferred from star ratings. The dataset was balanced to avoid class skew. Experimental results indicate that the CNN + BiLSTM model achieves moderate improvements over the baseline models, with an accuracy of 0.8861 and an F1-score of 0.8691. While it does not surpass the highest-performing transformer-based methods reported in the literature, it performs comparably to several of them, despite having a lower computational footprint. Analyses of ROC curves, confusion matrices, and training dynamics further contextualize the model’s performance, showing strengths in classifying negative sentiments and convergence efficiency. To address overfitting, early stopping and dropout layers were employed as regularization techniques. The study contributes to the ongoing discourse on resource-efficient sentiment analysis by showing that hybrid architectures may offer a practical balance between model complexity and performance in specific application domains. © 2025, Universitas Ahmad Dahlan. All rights reserved.","CNN-BiLSTM Architecture; Hybrid Deep Learning Models; Mobile App Reviews; Model Interpretability; Resource-efficient NLP; Sentiment Analysis","","","","","","","","","Article","Final","","Scopus","2-s2.0-105019513933"
"Toibazar, D.; Urmashev, B.; Tursynzhanova, A.; Nekrashevich, V.; Daurenova, I.; Niyazbayev, A.; KHAZIMOV, K.; Garbati Pegna, F.; Khazimov, M.","Toibazar, Daulet (57203748485); Urmashev, Baydaulet A. (59167326900); Tursynzhanova, Aliya A. (57536433600); Nekrashevich, Vladimir F. (57214120249); Daurenova, Indira (59226221400); Niyazbayev, A. K. (57200523716); KHAZIMOV, Kanat M. (56469755000); Garbati Pegna, Francesco (27967961600); Khazimov, M. Zh (55212169200)","57203748485; 59167326900; 57536433600; 57214120249; 59226221400; 57200523716; 56469755000; 27967961600; 55212169200","Bee Bread Drying Process Intensification in Combs Using Solar Energy","2025","Energies","18","9","2226","","","2","10.3390/en18092226","https://www.scopus.com/inward/record.uri?eid=2-s2.0-105004861250&doi=10.3390%2Fen18092226&partnerID=40&md5=9865be1c8b3e36aa164e96560f0445de","Faculty of Engineering, Kazakh National Agrarian Research University, Almaty, Kazakhstan; Institute of Energy and Green Technologies, Almaty University of Power Engineering and Telecommunications, Almaty, Almaty Province, Kazakhstan; Faculty of Information Technology, Al Farabi Kazakh National University, Almaty, Kazakhstan; School of Applied Mathematics, Kazakh-British Technical University, Almaty, Kazakhstan; Faculty of Engineering, Ryazan State Agrotechnological University Named After P.A. Kostychev, Ryazan, Russian Federation; Department of Information Systems, SDU University, Kaskelen, Almaty, Kazakhstan; Department of Agriculture, Università degli Studi di Firenze, Florence, FI, Italy","Toibazar, Daulet, Faculty of Engineering, Kazakh National Agrarian Research University, Almaty, Kazakhstan, Institute of Energy and Green Technologies, Almaty University of Power Engineering and Telecommunications, Almaty, Almaty Province, Kazakhstan; Urmashev, Baydaulet A., Faculty of Engineering, Kazakh National Agrarian Research University, Almaty, Kazakhstan, Faculty of Information Technology, Al Farabi Kazakh National University, Almaty, Kazakhstan; Tursynzhanova, Aliya A., School of Applied Mathematics, Kazakh-British Technical University, Almaty, Kazakhstan; Nekrashevich, Vladimir F., Faculty of Engineering, Ryazan State Agrotechnological University Named After P.A. Kostychev, Ryazan, Russian Federation; Daurenova, Indira, Faculty of Engineering, Kazakh National Agrarian Research University, Almaty, Kazakhstan, Institute of Energy and Green Technologies, Almaty University of Power Engineering and Telecommunications, Almaty, Almaty Province, Kazakhstan; Niyazbayev, A. K., Faculty of Engineering, Kazakh National Agrarian Research University, Almaty, Kazakhstan; KHAZIMOV, Kanat M., Faculty of Engineering, Kazakh National Agrarian Research University, Almaty, Kazakhstan, Department of Information Systems, SDU University, Kaskelen, Almaty, Kazakhstan; Garbati Pegna, Francesco, Department of Agriculture, Università degli Studi di Firenze, Florence, FI, Italy; Khazimov, M. Zh, Faculty of Engineering, Kazakh National Agrarian Research University, Almaty, Kazakhstan, Institute of Energy and Green Technologies, Almaty University of Power Engineering and Telecommunications, Almaty, Almaty Province, Kazakhstan","This study presents the development and evaluation of a stand-alone solar dryer designed to improve the efficiency of bee bread dehydration. Unlike the electric prototype powered by conventional energy sources, the proposed system operates autonomously, utilizing solar energy as the primary drying agent. The drying chamber is equipped with solar collectors located in its lower section, which ensure convective heating of the product. Active convection is generated by a set of fans powered by photovoltaic panels, maintaining the drying agent’s temperature near 42 °C. The research methodology integrates both numerical simulation and experimental investigation. Simulations focus on the variations in temperature (288–315 K) and relative humidity (1–1.5%) within the honeycomb structure under convective airflow. Experimental trials examine the relationship between moisture content and variables such as bee bread mass, airflow rate, number of frames (5–11 units), and drying time (2–11 h). A statistically grounded analysis based on an experimental design method was conducted, revealing a reduction in moisture content from 16.2–18.26% to 14.1–15.1% under optimized conditions. Linear regression models were derived to describe these dependencies. A comparative assessment using enthalpy–humidity (I–d) diagrams demonstrated the enhanced drying performance of the solar dryer, which is attributed to its cyclic operation mode. The results confirm the potential of the developed system for sustainable and energy-efficient drying of bee bread in decentralized conditions. © 2025 by the authors.","bee bread; bee products; energy; solar dryer; solar energy; temperature","Collector efficiency; Honeycomb structures; Linear regression; Natural convection; Solar concentrators; %moisture; Bee bread; Bee product; Conventional energy sources; Drying agent; Drying process; Energy; Process intensification; Stand -alone; Solar dryers","Ministry of Education and Science of the Republic of Kazakhstan, (AP19679448); Ministry of Education and Science of the Republic of Kazakhstan","The Committee of Science of the Ministry of Science and Higher Education of the Republic of Kazakhstan (No. AP19679448) have funded this research.","","","","","","Article","Final","All Open Access; Gold Open Access; Green Accepted Open Access; Green Open Access","Scopus","2-s2.0-105004861250"
