"Liu, Z.; Saydaliev, H.B.; Lan, J.; Ali, S.; Anser, M.K.","Liu, Zhen (59562843300); Saydaliev, Hayot Berk (57221252482); Lan, Jing (56506390400); Ali, Sajid (57214290499); Anser, Muhammad Khalid (57201617089)","59562843300; 57221252482; 56506390400; 57214290499; 57201617089","Assessing the effectiveness of biomass energy in mitigating CO2 emissions: Evidence from Top-10 biomass energy consumer countries","2022","Renewable Energy","191","","","842","851","73","10.1016/j.renene.2022.03.053","https://www.scopus.com/inward/record.uri?eid=2-s2.0-85129054194&doi=10.1016%2Fj.renene.2022.03.053&partnerID=40&md5=f36b8536bbd4a5aac02d6e27f05382d4","School of Business, Nanjing Normal University, Nanjing, Jiangsu, China; Associate Professor, SDU University, Kaskelen, Almaty, Kazakhstan; Department of Mathematical Methods in Economics, Tashkent State University of Economics, Tashkent, Uzbekistan; Environment and Development, Nanjing Agricultural University, Nanjing, Jiangsu, China; School of Economics, Bahauddin Zakariya University, Multan, Punjab, Pakistan; School of Public Administration, Xi'an University of Architecture and Technology, Xi'an, Shaanxi, China","Liu, Zhen, School of Business, Nanjing Normal University, Nanjing, Jiangsu, China; Saydaliev, Hayot Berk, Associate Professor, SDU University, Kaskelen, Almaty, Kazakhstan, Department of Mathematical Methods in Economics, Tashkent State University of Economics, Tashkent, Uzbekistan; Lan, Jing, Environment and Development, Nanjing Agricultural University, Nanjing, Jiangsu, China; Ali, Sajid, School of Economics, Bahauddin Zakariya University, Multan, Punjab, Pakistan; Anser, Muhammad Khalid, School of Public Administration, Xi'an University of Architecture and Technology, Xi'an, Shaanxi, China","Renewable energy has become more popular since it is cost-effective and more efficient than conventional energy sources. Biomass-based renewable energy is primarily used in emerging economies to ensure environmental sustainability. This study examines the asymmetric correlation between biomass energy consumption and CO<inf>2</inf> emissions in the top-10 biomass energy consumer countries (Brazil, Canada, Thailand, China, Italy, India, Germany, USA, UK, and Japan). A new approach “Quantile-on-Quantile (QQ)"" is employed by utilizing the data from 1991 to 2018. Biomass energy consumption, with the exception of Thailand, significantly mitigates CO<inf>2</inf> emissions at various quantiles in selected countries. As a robustness check, we used the quantile regression test, whose findings are consistent with the outcomes from the quantile-on-quantile method. However, the degree of asymmetry in the biomass energy-CO<inf>2</inf> nexus varies by country, necessitating extra attention and government vigilance when developing biomass energy and environmental policies. © 2022 Elsevier Ltd","Biomass energy consumption; CO2 emissions; Quantile-on-quantile estimation","Binary alloys; Carbon dioxide; Cost effectiveness; Energy utilization; Environmental protection; Potassium alloys; Sustainable development; Uranium alloys; Bio-mass energy; Biomass energy consumption; CO 2 emission; Energy consumer; Energy-consumption; IS costs; Quantile estimation; Quantile-on-quantile estimation; Renewable energies; Thailand; Biomass; alternative energy; biomass power; carbon dioxide; carbon emission; estimation method; government; vigilance; Brazil; Canada; China; Germany; India; Italy; Japan; United Kingdom; United States","National Natural Science Foundation of China, NSFC, (71911530164, 72074114); National Natural Science Foundation of China, NSFC; Qinglan Project of Jiangsu Province of China","This research was funded by the National Natural Science Foundation of China , grant number 72074114 , 71911530164 and supported by Qinglan Project of Jiangsu Province .","","","","","","Article","Final","","Scopus","2-s2.0-85129054194"
"Mohsin, M.; Taghizadeh-Hesary, F.; Iqbal, N.; Saydaliev, H.B.","Mohsin, Muhammad (57217376244); Taghizadeh-Hesary, Farhad (56291956400); Iqbal, Nadeem (56985486800); Saydaliev, Hayot Berk (57221252482)","57217376244; 56291956400; 56985486800; 57221252482","The role of technological progress and renewable energy deployment in green economic growth","2022","Renewable Energy","190","","","777","787","246","10.1016/j.renene.2022.03.076","https://www.scopus.com/inward/record.uri?eid=2-s2.0-85127505800&doi=10.1016%2Fj.renene.2022.03.076&partnerID=40&md5=43a0465987713ad0763374373072d66f","School of Finance and Economics, Jiangsu University, Zhenjiang, Jiangsu, China; School of Global Studies, Tokai University, Tokyo, Japan; Tokai University, Tokyo, Japan; School of Management, Air University Islamabad, Islamabad, Pakistan; School of Business, SDU University, Kaskelen, Almaty, Kazakhstan; Department of Mathematical Methods in Economics, Tashkent State University of Economics, Tashkent, Uzbekistan","Mohsin, Muhammad, School of Finance and Economics, Jiangsu University, Zhenjiang, Jiangsu, China; Taghizadeh-Hesary, Farhad, School of Global Studies, Tokai University, Tokyo, Japan, Tokai University, Tokyo, Japan; Iqbal, Nadeem, School of Management, Air University Islamabad, Islamabad, Pakistan; Saydaliev, Hayot Berk, School of Business, SDU University, Kaskelen, Almaty, Kazakhstan, Department of Mathematical Methods in Economics, Tashkent State University of Economics, Tashkent, Uzbekistan","This study aims to measure the relationship between technological progress, renewable energy, and green economic growth (GEG). This study uses a data envelopment analysis (DEA) estimation method to evaluate the association between government expenditure on research and development (R&D), renewable energy deployment, and GEG in the Economic Community of West African States (ECOWAS) between 1990 and 2018. The estimates revealed an inconsistent GEG indicator in the analysis, suggesting the lesser impact disposition of public policy. In addition, the energy efficiency ratio of ECOWAS sub-region is under 0.50, implying energy poverty in the sub-region. Many people do not have sufficient energy to heat and cool their homes to enough temperature and meet their basic needs and energy security concerns. This research discovered that a percentage growth increase in renewable energy deployment results in a 3.2% increase in growth in sustainable performance. Alongside an essential effect of one percentage point growth in R&D expenditure boosts economic system sustainable performance to 4.4% combined with a supported effect of one percent. This research reveals that the ECOWAS government expenditure on human resources and R&D of sustainable energy resources would result in a low carbon growth via an advanced technological production process; nevertheless, the impacts are varied in the various countries in ECOWAS. © 2022 Elsevier Ltd","Data envelopment analysis; Decision making units; Economic community of west African states; Energy efficiency; Green development; Renewable energy","Behavioral research; Data envelopment analysis; Economic analysis; Energy efficiency; Energy security; Decision making unit; Economic Community of West African States; Economic growths; Government expenditure; Green development; Renewable energies; Renewable energy deployments; Research and development; Sub-regions; Technological progress; Decision making; alternative energy; economic growth; energy efficiency; green economy; public spending; research and development; West Africa","Japan Society for the Promotion of Science, JSPS, (22K13432); Japan Society for the Promotion of Science, JSPS","","","","","","","Article","Final","","Scopus","2-s2.0-85127505800"
"Shanbayev, M.; Turgumbayeva, K.; Blumberga, D.; Aipenova, A.; Beisekova, T.","Shanbayev, Maxat Zh (57192687010); Turgumbayeva, Kh Kh (57192678028); Blumberga, Dagnija (6504072758); Aipenova, Aziza S. (56295076700); Beisekova, Tuleuzhan I. (57192677206)","57192687010; 57192678028; 6504072758; 56295076700; 57192677206","Environmental and Economic Advantages of Disposal of Phosphoric Industry Waste","2022","Environmental and Climate Technologies","26","1","","143","154","3","10.2478/rtuect-2022-0012","https://www.scopus.com/inward/record.uri?eid=2-s2.0-85127887349&doi=10.2478%2Frtuect-2022-0012&partnerID=40&md5=8131660601b48088f2432ddb8b6bcf3a","Satbayev University, Almaty, Kazakhstan; Institute of Energy Systems and Environment, Riga Technical University, Riga, Latvia; SDU University, Kaskelen, Almaty, Kazakhstan; Almaty University of Power Engineering and Telecommunications, Almaty, Almaty Province, Kazakhstan","Shanbayev, Maxat Zh, Satbayev University, Almaty, Kazakhstan; Turgumbayeva, Kh Kh, Institute of Energy Systems and Environment, Riga Technical University, Riga, Latvia; Blumberga, Dagnija, Institute of Energy Systems and Environment, Riga Technical University, Riga, Latvia; Aipenova, Aziza S., SDU University, Kaskelen, Almaty, Kazakhstan; Beisekova, Tuleuzhan I., Almaty University of Power Engineering and Telecommunications, Almaty, Almaty Province, Kazakhstan","The article presents the types and classification of waste from the phosphorus industry of the Zhambyl region of the Republic of Kazakhstan. Waste is classified by its use as recyclable materials for construction materials. The results of a comparative assessment of the physical, chemical and structural properties of the phosphorus industry waste are presented. The article shows that all studied types of waste have astringent properties and can be used as building materials. In this work, a study of the properties of large-tonnage wastes of the phosphorus industry was carried out: 1) electrothermophosphoric granular slag (granulated slag); 2) phosphogypsum; 3) overburden. A technology has been developed for producing non-fired binders from waste of the phosphorus industry and a methodology for designing the composition of raw mixtures of multicomponent building composites has been proposed. Pilot tests and calculation of technical and economic indicators have been carried out, which have shown the economic feasibility of producing a non-firing binder for the construction industry from phosphorus production waste. © 2022 Maxat Shanbayev et al., published by Sciendo.","Binders; construction composites; phosphogypsum; recycling; technogenic waste","Building materials; Construction industry; Gypsum; Phosphorus; Slags; Waste disposal; Classifieds; Comparative assessment; Construction composite; Economic advantages; Industry wastes; Kazakhstan; Phosphogypsum; Property; Recyclable material; Technogenic wastes; Binders; chemical binding; composite; construction material; environmental economics; feasibility study; gypsum; industrial waste; phosphorus; recycling; slag; waste disposal","","","","","","","","Article","Final","All Open Access; Gold Open Access; Green Accepted Open Access; Green Open Access","Scopus","2-s2.0-85127887349"
"Chingiz, C.; Buribayev, Z.; Amirgaliyev, Y.; Ataniyazova, A.; Aitimov, A.","Chingiz, Kenshimov (57170816600); Buribayev, Zholdas A. (57204640972); Amirgaliyev, Yedilkhan Nesipkhanovich (56167524400); Ataniyazova, Aisulyu S. (57298357700); Aitimov, Askhat (57207766577)","57170816600; 57204640972; 56167524400; 57298357700; 57207766577","SIGN LANGUAGE DACTYL RECOGNITION BASED ON MACHINE LEARNING ALGORITHMS","2021","Eastern-European Journal of Enterprise Technologies","4","2-112","","58","72","12","10.15587/1729-4061.2021.239253","https://www.scopus.com/inward/record.uri?eid=2-s2.0-85117223595&doi=10.15587%2F1729-4061.2021.239253&partnerID=40&md5=22e891fea187996088d3d45f8da5f90c","Institute of Information and Computational Technologies, Almaty, Kazakhstan; SDU University, Kaskelen, Almaty, Kazakhstan; Department of Computer Science, Al Farabi Kazakh National University, Almaty, Kazakhstan","Chingiz, Kenshimov, Institute of Information and Computational Technologies, Almaty, Kazakhstan; Buribayev, Zholdas A., Department of Computer Science, Al Farabi Kazakh National University, Almaty, Kazakhstan; Amirgaliyev, Yedilkhan Nesipkhanovich, SDU University, Kaskelen, Almaty, Kazakhstan; Ataniyazova, Aisulyu S., Department of Computer Science, Al Farabi Kazakh National University, Almaty, Kazakhstan; Aitimov, Askhat, SDU University, Kaskelen, Almaty, Kazakhstan","In the course of our research work, the American, Russian and Turkish sign languages were analyzed. The program of recognition of the Kazakh dactylic sign language with the use of machine learning methods is implemented. A dataset of 5000 images was formed for each gesture, gesture recognition algorithms were applied, such as Random Forest, Support Vector Machine, Extreme Gradient Boosting, while two data types were combined into one database, which caused a change in the architecture of the system as a whole. The quality of the algorithms was also evaluated. The research work was carried out due to the fact that scientific work in the field of developing a system for recognizing the Kazakh language of sign dactyls is currently insufficient for a complete representation of the language. There are specific letters in the Kazakh language, because of the peculiarities of the spelling of the language, problems arise when developing recognition systems for the Kazakh sign language. The results of the work showed that the Support Vector Machine and Extreme Gradient Boosting algorithms are superior in real-time performance, but the Random Forest algorithm has high recognition accuracy. As a result, the accuracy of the classification algorithms was 98.86 % for Random Forest, 98.68 % for Support Vector Machine and 98.54 % for Extreme Gradient Boosting. Also, the evaluation of the quality of the work of classical algorithms has high indicators. The practical significance of this work lies in the fact that scientific research in the field of gesture recognition with the updated alphabet of the Kazakh language has not yet been conducted and the results of this work can be used by other researchers to conduct further research related to the recognition of the Kazakh dactyl sign language, as well as by researchers, engaged in the development of the international sign language © 2021. All Rights Reserved.","algorithm evaluation; feature extraction; Gesture recognition; hand tracking; sign language","","Ministry of Education and Science of the Republic of Kazakhstan, (AP08053034)","This research is funded by grant from the Science Committee of the Ministry of Education and Science of the Republic of Kazakhstan within the framework of the Project № AP08053034.","","","","","","Article","Final","All Open Access; Gold Open Access; Green Accepted Open Access; Green Open Access","Scopus","2-s2.0-85117223595"
"Turan, C.; Salman, M.S.","Turan, Cemil (56246423000); Salman, Mohammad Shukri (55293857100)","56246423000; 55293857100","A block LMS-Type algorithm for sparse system identification with analysis","2017","2017 International Siberian Conference on Control and Communications, SIBCON 2017 - Proceedings","","","7998557","","","1","10.1109/SIBCON.2017.7998557","https://www.scopus.com/inward/record.uri?eid=2-s2.0-85028517255&doi=10.1109%2FSIBCON.2017.7998557&partnerID=40&md5=3c973cd88279d16c9ea8459e19d9864a","Department of Computer Engineering, SDU University, Kaskelen, Almaty, Kazakhstan; Department of Electrical Engineering, American University of the Middle East, Al Ahmadi, Kuwait","Turan, Cemil, Department of Computer Engineering, SDU University, Kaskelen, Almaty, Kazakhstan; Salman, Mohammad Shukri, Department of Electrical Engineering, American University of the Middle East, Al Ahmadi, Kuwait","The LMS-Type algorithms are effectively used in diverse adaptive filtering applications such as; blind system identification, channel equalization, etc. For some applications such as echo cancellation, which requires a large filter length, a very long time is required to estimate the coefficients via the conventional least-mean-square (LMS) algorithm. Actually, updating the filter coefficients block by block of the input data but not for each sample of input, users can get a very fast processing time depending on the block length. Additionally, the performance of the block-LMS (BLMS) algorithm can be improved by using a variable step-size in the update equation. Also, in system identification, if the unknown system is sparse, then the performance of the algorithm can be improved further by imposing a penalty term in the cost function of the BLMS algorithm which, in turn, helps in exploiting the sparsity of the unknown system. In this paper, we investigate the performance of recently proposed BLMS-Type algorithm for sparse systems. The convergence analysis of the proposed algorithm is presented for the first time. Also, the effects of the zero-Attracting coefficient, ρ, and the sparsity degree on MSD have been investigated. Finally, the performance of the algorithm is compared to those of the BLMS and the other previously proposed adaptive algorithms, in terms of convergence rate and mean-square-deviation (MSD). Simulations show that the proposed algorithm guarantees better performance than the other algorithms. © 2017 IEEE.","Block LMS Algorithm; System Identification; Zero-Attracting","Adaptive algorithms; Adaptive filters; Cost functions; Echo suppression; Identification (control systems); Religious buildings; Blind system identification; Channel equalization; Filtering applications; Least mean square algorithms; LMS algorithms; Mean-square deviation; Sparse system identification; Zero-attracting; Adaptive filtering","","","","2017 International Siberian Conference on Control and Communications, SIBCON 2017","2017-06-29 through 2017-06-30","Astana","129746","Conference paper","Final","","Scopus","2-s2.0-85028517255"
"Szulczyk, K.R.; McCarl, B.A.","Szulczyk, Kenneth R. (29967547800); McCarl, Bruce A. (7005687334)","29967547800; 7005687334","Market penetration of biodiesel","2010","Renewable and Sustainable Energy Reviews","14","8","","2426","2433","51","10.1016/j.rser.2010.05.008","https://www.scopus.com/inward/record.uri?eid=2-s2.0-77954648331&doi=10.1016%2Fj.rser.2010.05.008&partnerID=40&md5=c426c0f4e7c3b889bfc8bea1cefd6e6e","Department of Economics, SDU University, Kaskelen, Almaty, Kazakhstan; Department of Agricultural Economics, Texas A&M University, College Station, TX, United States","Szulczyk, Kenneth R., Department of Economics, SDU University, Kaskelen, Almaty, Kazakhstan; McCarl, Bruce A., Department of Agricultural Economics, Texas A&M University, College Station, TX, United States","This research examines in detail the technology and economics of substituting biodiesel for diesel #2. This endeavor examines three areas. First, the benefits of biodiesel are examined, and the technical problems of large-scale implementation. Second, the biodiesel production possibilities are examined for soybean oil, corn oil, tallow, and yellow grease, which are the largest sources of feedstocks for the United States. Examining in detail the production possibilities allows to identity the extent of technological change, production costs, byproducts, and greenhouse gas (GHG) emissions. Finally, a U.S. agricultural model, FASOMGHG was used to predict market penetration of biodiesel, given technological progress, variety of technologies and feedstocks, market interactions, energy prices, and carbon dioxide equivalent prices. FASOMGHG has several interesting results. First, diesel fuel prices have an expansionary impact on the biodiesel industry. The higher the diesel fuel prices, the more biodiesel is produced. However, given the most favorable circumstances, the maximum biodiesel market penetration is 9% in 2030 with a wholesale diesel price of $4 per gallon. Second, the two dominant sources of biodiesel are from corn and soybeans. Sources like tallow and yellow grease are more limited, because they are byproducts of other industries. Third, GHG prices have an expansionary impact on the biodiesel prices, because biodiesel is quite GHG efficient. Finally, U.S. government subsidies on biofuels have an expansionary impact on biodiesel production, and increase market penetration at least an additional 3%. © 2010 Elsevier Ltd.","Agricultural sector model; Alternative energy; Biodiesel; Carbon equivalent price; Emission trading","Agriculture; Byproducts; Carbon dioxide; Commerce; Costs; Diesel fuels; Feedstocks; Gas emissions; Greenhouse gases; Soybean oil; Agricultural sector models; Alternative energy; Biodiesel production; Carbon equivalent; Emission trading; Government subsidies; Technological change; Technological progress; Biodiesel","","","","","","","","Review","Final","","Scopus","2-s2.0-77954648331"
