"Ahmed, M.; Bakar, A.; Orynbassar, A.; Shynarbek, N.; Tahir, M.A.; Shalenov, E.O.; Ibraheem, A.A.","Ahmed, M. Waqas (55248564400); Bakar, Abu (56711354100); Orynbassar, Alibek (57220763198); Shynarbek, Nurdaulet (57459629800); Tahir, Muhammad Ateeq (58984037000); Shalenov, E. O. (55693577400); Ibraheem, Awad A. (6602756628)","55248564400; 56711354100; 57220763198; 57459629800; 58984037000; 55693577400; 6602756628","First principles investigations of Lithium based hydrides LiXH 3(X=Al, Ga, In) for hydrogen storage applications","2025","International Journal of Hydrogen Energy","98","","","25","34","19","10.1016/j.ijhydene.2024.11.409","https://www.scopus.com/inward/record.uri?eid=2-s2.0-85211067904&doi=10.1016%2Fj.ijhydene.2024.11.409&partnerID=40&md5=f4ba287c0f3fab77427b0083f3569191","Centre of Excellence in Solid State Physics, University of the Punjab, Lahore, Punjab, Pakistan; Department of Pedagogy of Natural Sciences, SDU University, Kaskelen, Almaty, Kazakhstan; School of Digital Technologies, Narxoz University, Almaty, Kazakhstan; Department of Physics, Satbayev University, Almaty, Kazakhstan; Department of Physics, King Khalid University, Abha, Asir, Saudi Arabia","Ahmed, M. Waqas, Centre of Excellence in Solid State Physics, University of the Punjab, Lahore, Punjab, Pakistan; Bakar, Abu, Centre of Excellence in Solid State Physics, University of the Punjab, Lahore, Punjab, Pakistan; Orynbassar, Alibek, Department of Pedagogy of Natural Sciences, SDU University, Kaskelen, Almaty, Kazakhstan; Shynarbek, Nurdaulet, Department of Pedagogy of Natural Sciences, SDU University, Kaskelen, Almaty, Kazakhstan; Tahir, Muhammad Ateeq, School of Digital Technologies, Narxoz University, Almaty, Kazakhstan; Shalenov, E. O., Department of Physics, Satbayev University, Almaty, Kazakhstan; Ibraheem, Awad A., Department of Physics, King Khalid University, Abha, Asir, Saudi Arabia","The investigation of hydrogen storage properties of hydride perovskites have been emerged as great research domain in recent times. The current study focuses on the first principles exploration of lithium based hydrides, LiXH <inf>3</inf>(X=Al, Ga, In), for hydrogen storage and other physical properties. The structural properties of these hydrides show that the lattice constants of LiAlH <inf>3</inf>, LiGaH <inf>3</inf> and LiInH <inf>3</inf> are 3.68, 3.74, and 4.09 Å. respectively. The gravimetric hydrogen storage capacity (C <inf>wt</inf>%) of LiAlH <inf>3</inf>, LiGaH <inf>3</inf> and LiInH <inf>3</inf> is 7.57, 3.66 and 2.37%, respectively. The negative formation energy for these compounds show the stability of these hydrides. The electronic band structures and density of states of under study hydride perovskites validate their metallic nature. The complex dielectric constant, reflectivity and absorption coefficient are investigated to reveal optical response of LiXH <inf>3</inf>(X=Al, Ga, In). The significant thermodynamic parameters like Debye temperature, specific heat capacities, entropy and thermal expansion coefficient under the effect of temperature and pressure are elaborated to determine the thermodynamic stability. For better understanding of thermoelectric characteristics of these compounds, thermoelectric parameters under wide range of temperature are also studied. The excellent gravimetric hydrogen storage capacity and volumetric hydrogen storage density of these hydride perovskites make them promising materials for hydrogen storage applications. © 2024 Hydrogen Energy Publications LLC","First principles study; Gravimetric hydrogen storage capacity; Hydrides; Thermoelectric properties","Aluminum compounds; Bulk Density; Density (optical); Gallium compounds; Lithium compounds; Temperature; 'current; First principles; First-principle study; First-principles investigations; Gravimetric hydrogen storage capacity; Hydrogen storage capacities; Hydrogen-storage properties; Property; Research domains; Thermoelectric properties; Specific heat","King Khalid University, KKU, (CL/PAT/7, R.G.P.2/89/45); King Khalid University, KKU","Funding text 1: The authors extend their appreciation to University Higher Education Fund for funding this research work under Research Support Program for Central labs at King Khalid University through the project number CL/PAT/7 .; Funding text 2: The authors extend their appreciation to Deanship of Scientific Research at King Khalid University for funding this research work through large groups project under grant number R.G.P.2/89/45.","","","","","","Article","Final","","Scopus","2-s2.0-85211067904"
"Ahmed, M.; Fatima, R.; Bakar, A.; Orynbassar, A.; Shynarbek, N.; Khairy, Y.","Ahmed, M. Waqas (55248564400); Fatima, Rida (57191904110); Bakar, Abu (56711354100); Orynbassar, Alibek (57220763198); Shynarbek, Nurdaulet (57459629800); Khairy, Yasmin (55823472700)","55248564400; 57191904110; 56711354100; 57220763198; 57459629800; 55823472700","Exploration of hydrides XSrH3(X=Cs,Fr) for hydrogen storage applications: A first principles study","2024","International Journal of Hydrogen Energy","83","","","460","471","22","10.1016/j.ijhydene.2024.08.076","https://www.scopus.com/inward/record.uri?eid=2-s2.0-85201020226&doi=10.1016%2Fj.ijhydene.2024.08.076&partnerID=40&md5=ad648227571f3a23e2a5b4ebc3cf8093","Centre of Excellence in Solid State Physics, University of the Punjab, Lahore, Punjab, Pakistan; Department of Pedagogy of Natural Sciences, SDU University, Kaskelen, Almaty, Kazakhstan; Department of Physics, King Khalid University, Abha, Asir, Saudi Arabia","Ahmed, M. Waqas, Centre of Excellence in Solid State Physics, University of the Punjab, Lahore, Punjab, Pakistan; Fatima, Rida, Centre of Excellence in Solid State Physics, University of the Punjab, Lahore, Punjab, Pakistan; Bakar, Abu, Centre of Excellence in Solid State Physics, University of the Punjab, Lahore, Punjab, Pakistan; Orynbassar, Alibek, Department of Pedagogy of Natural Sciences, SDU University, Kaskelen, Almaty, Kazakhstan; Shynarbek, Nurdaulet, Department of Pedagogy of Natural Sciences, SDU University, Kaskelen, Almaty, Kazakhstan; Khairy, Yasmin, Department of Physics, King Khalid University, Abha, Asir, Saudi Arabia","The strontium based hydrides XSrH<inf>3</inf>(X=Cs,Fr) are investigated in current study using first principles calculations for hydrogen storage applications. The obtained lattice constants for CsSrH<inf>3</inf> and FrSrH<inf>3</inf> are 4.88 Å and 4.74 Å respectively. The gravimetric hydrogen storage capacity (C<inf>wt</inf>%) for CsSrH<inf>3</inf> and FrSrH<inf>3</inf> is 1.33% and 0.95%. The optimized lattice constants are utilized to compute elastic constants and mechanical parameters. The Young's modulus, bulk modulus and shear modulus for FrSrH<inf>3</inf> is larger than that of CsSrH<inf>3</inf> revealing the greater mechanical strength of FrSrH<inf>3</inf>. The investigations of band structures and density of states indicating the semiconducting nature of with gaps 2.95 eV, 2.52 eV with PBE-GGA and 5.40 eV, 4.54 eV with TB-mBJ for CsSrH<inf>3</inf> and FrSrH<inf>3</inf> respectively. The dynamical stability for both hydrides is confirmed from phonon properties. The thermodynamic parameters are calculated under the variation of temperature and pressure. The heat capacities, volume, entropy and thermal expansion coefficient increase with temperature and decrease with pressure. © 2024 Hydrogen Energy Publications LLC","Elastic constants; Hydrides; Hydrogen storage; Thermodynamic properties","Cesium compounds; Elastic moduli; Hydrides; Hydrogen storage; Lattice constants; Stability; Strontium compounds; Thermal expansion; 'current; Densities of state; Elastic constant parameters; First principle calculations; First-principle study; Hydrogen storage capacities; Mechanical; Mechanical parameters; Thermodynamics property; Young modulus; Elastic constants","King Khalid University, KKU, (RGP2/31/45); King Khalid University, KKU","The authors extend their appreciation to the Deanship of Research and Graduate Studies at King Khalid University for funding this work through Large Research Project under grant number RGP2/31/45 .","","","","","","Article","Final","","Scopus","2-s2.0-85201020226"
"Daurenbayeva, N.; Nurlanuly, A.; Atymtayeva, L.; Mendes, M.","Daurenbayeva, Nurkamilya (58220836600); Nurlanuly, Almas (57215928902); Atymtayeva, Lyazzat (42061007500); Mendes, Mateus (59281968600)","58220836600; 57215928902; 42061007500; 59281968600","Survey of Applications of Machine Learning for Fault Detection, Diagnosis and Prediction in Microclimate Control Systems","2023","Energies","16","8","3508","","","8","10.3390/en16083508","https://www.scopus.com/inward/record.uri?eid=2-s2.0-85156146528&doi=10.3390%2Fen16083508&partnerID=40&md5=67ae01c6ea355477c2d416fcfa00b6aa","International Information Technology University, Almaty, Kazakhstan; Department of Aviation Equipment and Technology, Civil Aviation Academy, Almaty, Kazakhstan; Department of Information Systems, SDU University, Kaskelen, Almaty, Kazakhstan; Coimbra Polytechnic - ISEC, Coimbra, Coimbra, Portugal; University of Coimbra, Institute of Systems and Robotics, Coimbra, Portugal","Daurenbayeva, Nurkamilya, International Information Technology University, Almaty, Kazakhstan; Nurlanuly, Almas, Department of Aviation Equipment and Technology, Civil Aviation Academy, Almaty, Kazakhstan; Atymtayeva, Lyazzat, Department of Information Systems, SDU University, Kaskelen, Almaty, Kazakhstan; Mendes, Mateus, Coimbra Polytechnic - ISEC, Coimbra, Coimbra, Portugal, University of Coimbra, Institute of Systems and Robotics, Coimbra, Portugal","An appropriate microclimate is one of the most important factors of a healthy and comfortable life. The microclimate of a place is determined by the temperature, humidity and speed of the air. Those factors determine how a person feels thermal comfort and, therefore, they play an essential role in people’s lives. Control of microclimate parameters is a very important topic for buildings, as well as greenhouses, where adequate microclimate is fundamental for best-growing results. Microclimate systems require adequate monitoring and maintenance, for their failure or suboptimal performance can increase energy consumption and have catastrophic results. In recent years, Fault Detection and Diagnosis in microclimate systems have been paid more attention. The main goal of those systems is to effectively detect faults and accurately isolate them to a failing component in the shortest time possible. Sometimes it is even possible to predict and anticipate failures, which allows preventing the failures from happening if appropriate measures are taken in time. The present paper reviews the state of the art in fault detection and diagnosis methods. It shows the growing importance of the topic and highlights important open research questions. © 2023 by the authors.","fault detection and diagnosis; machine learning; microclimate control systems; prediction methods","Energy utilization; Fault detection; Forecasting; Machine learning; Energy-consumption; Fault detection and diagnosis; Fault detection/diagnosis; Fault prediction; Machine-learning; Microclimate control; Microclimate control system; Prediction methods; Sub-optimal performance; Temperature/ humidities; Control systems","(12598/2020)","This work received financial support from the Polytechnic Institute of Coimbra within the scope of Regulamento de Apoio à Publicação Científica dos Professores e Investigadores do IPC (Despacho n.° 12598/2020).","","","","","","Review","Final","All Open Access; Gold Open Access; Green Accepted Open Access; Green Open Access","Scopus","2-s2.0-85156146528"
"Chang, L.; Taghizadeh-Hesary, F.; Saydaliev, H.B.","Chang, Lei (57325381100); Taghizadeh-Hesary, Farhad (56291956400); Saydaliev, Hayot Berk (57221252482)","57325381100; 56291956400; 57221252482","How do ICT and renewable energy impact sustainable development?","2022","Renewable Energy","199","","","123","131","107","10.1016/j.renene.2022.08.082","https://www.scopus.com/inward/record.uri?eid=2-s2.0-85137604362&doi=10.1016%2Fj.renene.2022.08.082&partnerID=40&md5=efe9ce4925209c974df44ee8434ecff2","School of Management, University of Science and Technology of China, Hefei, Anhui, China; School of Global Studies, Tokai University, Tokyo, Japan; Tokai University, Tokyo, Japan; School of Business, SDU University, Kaskelen, Almaty, Kazakhstan; Department of Mathematical Methods in Economics, Tashkent State University of Economics, Tashkent, Uzbekistan","Chang, Lei, School of Management, University of Science and Technology of China, Hefei, Anhui, China; Taghizadeh-Hesary, Farhad, School of Global Studies, Tokai University, Tokyo, Japan, Tokai University, Tokyo, Japan; Saydaliev, Hayot Berk, School of Business, SDU University, Kaskelen, Almaty, Kazakhstan, Department of Mathematical Methods in Economics, Tashkent State University of Economics, Tashkent, Uzbekistan","This study aims to analyze whether information and communication technology (ICT) and renewable energy (RE) can assist in enhancing environmental quality. This study employs time series data from 1990 to 2019 using econometric techniques. The results show that the use of ICTs in the US, UK, China, Russia, Canada, Australia, Sweden, Norway, Switzerland, and Italy has decreased environmental protection. The results reveal that RE use enhances the sustainability of the environment regardless of the sample size or surrogate utilized for ICT. Impulse response functions show that, on average, the influence of ICT and RE lasts between one and seven years. The error correction model segmentation study verified that ICT and RE contribute to the volatility of carbon dioxide emissions. There is strong evidence that carbon dioxide emissions, ICT, and RE use have a bidirectional causal relationship in most circumstances. Several ICTs and RE strategies have been established and explored to profit from the possible positive influence of ICT and RE usage on environmental quality. © 2022 Elsevier Ltd","CO2 mitigation; Environmental sustainability; ICTs; Renewable energy","","Japan Society for the Promotion of Science, KAKEN, (23K25070, 22H03816); Japan Society for the Promotion of Science, KAKEN; Ministry of Education, Culture, Sports, Science and Technology, MEXT, (22K13432); Ministry of Education, Culture, Sports, Science and Technology, MEXT","Farhad Taghizadeh-Hesary acknowledges the financial support of the Grant-in-Aid for the Excellent Young Researcher of the Ministry of Education, Culture, Sports, Science and Technology of Japan (MEXT) ; Grant-in-Aid for Young Scientists (No. 22K13432 ) of the Japan Society for the Promotion of Science (JSPS) and the Grant-in-Aid for Scientific Research (B) (No. 22H03816 ) of the JSPS .","","","","","","Article","Final","","Scopus","2-s2.0-85137604362"
"Chang, L.; Saydaliev, H.B.; Meo, M.S.; Mohsin, M.","Chang, Lei (57325381100); Saydaliev, Hayot Berk (57221252482); Meo, Muhammad Saeed (57201216614); Mohsin, Muhammad (57217376244)","57325381100; 57221252482; 57201216614; 57217376244","How renewable energy matter for environmental sustainability: Evidence from top-10 wind energy consumer countries of European Union","2022","Sustainable Energy, Grids and Networks","31","","100716","","","110","10.1016/j.segan.2022.100716","https://www.scopus.com/inward/record.uri?eid=2-s2.0-85129975235&doi=10.1016%2Fj.segan.2022.100716&partnerID=40&md5=921f09d409ae8307a933ba120fbc062f","School of Management, University of Science and Technology of China, Hefei, Anhui, China; School of Business, SDU University, Kaskelen, Almaty, Kazakhstan; Department of Mathematical Methods in Economics, Tashkent State University of Economics, Tashkent, Uzbekistan; The Superior University, Lahore, Lahore, Punjab, Pakistan; Technology and Sustainable Development, RUDN University, Moscow, Moscow Oblast, Russian Federation; School of Finance and Economics, Jiangsu University, Zhenjiang, Jiangsu, China","Chang, Lei, School of Management, University of Science and Technology of China, Hefei, Anhui, China; Saydaliev, Hayot Berk, School of Business, SDU University, Kaskelen, Almaty, Kazakhstan, Department of Mathematical Methods in Economics, Tashkent State University of Economics, Tashkent, Uzbekistan; Meo, Muhammad Saeed, The Superior University, Lahore, Lahore, Punjab, Pakistan, Technology and Sustainable Development, RUDN University, Moscow, Moscow Oblast, Russian Federation; Mohsin, Muhammad, School of Finance and Economics, Jiangsu University, Zhenjiang, Jiangsu, China","Renewable energy sources are becoming increasingly popular since they are less expensive and more effective than conventional energy sources. New green energy technologies, such as wind energy, are mostly used in emerging regions to provide a sustainable and clean environment. This study investigates the effect of wind-based renewable energy consumption for environmental sustainability in top-10 wind energy consumer countries of European Union for the years 1991 to 2018. Ecological footprint is utilized as a proxy for the environmental sustainability. Most past studies have relied on panel data methods to produce common outcomes on the wind energy-clean environment nexus by overlooking the individual country-based evidences. On the other hand, this study adopts a unique method known as “Quantile-on-Quantile (QQ)”, which can assess the time-series dependency in each country separately in order to provide global yet country-specific proof for the relationship between the variables. The empirical findings show that wind-based renewable energy consumption is a main cause of reducing ecological footprint at different quantiles of the data distribution in 8 out of 10 selected countries. The degree of the asymmetric relation, however, differs by country, needing specific awareness and attention on the part of the authorities when formulating the policies relating to wind energy and environmental sustainability. © 2022 Elsevier Ltd","Ecological footprint; Environmental sustainability; Renewable energy; Wind-based renewable energy","Ecology; Energy policy; Energy utilization; Sustainable development; Clean environment; Ecological footprint; Energy consumer; Environmental sustainability; European union; Renewable energies; Renewable energy consumption; Renewable energy source; Wind-based renewable energy; Wind power","","","","","","","","Article","Final","","Scopus","2-s2.0-85129975235"
"Zhang, L.; Saydaliev, H.B.; Ma, X.","Zhang, Ling (57428639700); Saydaliev, Hayot Berk (57221252482); Ma, Xiaoyu (57704669700)","57428639700; 57221252482; 57704669700","Does green finance investment and technological innovation improve renewable energy efficiency and sustainable development goals","2022","Renewable Energy","193","","","991","1000","211","10.1016/j.renene.2022.04.161","https://www.scopus.com/inward/record.uri?eid=2-s2.0-85130581818&doi=10.1016%2Fj.renene.2022.04.161&partnerID=40&md5=684187a6b0f934e2de187dd2b14aa1fb","School of Business, Nanjing Xiaozhuang College, Nanjing, Jiangsu, China; School of Business, SDU University, Kaskelen, Almaty, Kazakhstan; Department of Mathematical Methods in Economics, Tashkent State University of Economics, Tashkent, Uzbekistan; School of Finance and Trade, Wenzhou Business College, Wenzhou, Zhejiang, China","Zhang, Ling, School of Business, Nanjing Xiaozhuang College, Nanjing, Jiangsu, China; Saydaliev, Hayot Berk, School of Business, SDU University, Kaskelen, Almaty, Kazakhstan, Department of Mathematical Methods in Economics, Tashkent State University of Economics, Tashkent, Uzbekistan; Ma, Xiaoyu, School of Finance and Trade, Wenzhou Business College, Wenzhou, Zhejiang, China","Sustainable goals are achieved by utilizing private firms' investment in renewable energy sources. Globally, the demand for alternative sources of Renewable Energy (RE) and green finance (GF) has prompted an increase in research on these topics. This research applies a novel technique panel cointegration and causality model to evaluate the causes of green finance development in China between 1990 and 2020. This study adds information on the relationship between green finance and financial inclusion in the form of private firms' investments. The findings show that green finance and financial inclusion (FI) are beneficial to development globally and more granular. For every 1% growth in RE sources, there will be a 0.522% rise in trademark filings and a 0.1243% rise in private sector investment filings. The trademark and patent are promoted by 0.062% when financial inclusion is improved by 0.031%. Investment, commerce, and human progress have a calming effect on the connection discussed above. A variety of robustness tests supports our model results. This study's policy recommendations include decentralizing the energy industry to allow for more private sector participation; financial incentives for enterprises to use RE. It is clear from these findings that our study contributes significantly to the field of empirical research and also gives crucial policy recommendations. © 2022 Elsevier Ltd","China; Financial inclusion; Green finance; Panel cointegration and causality; Renewable energy; Sustainability goals","Commerce; Energy efficiency; Investments; Patents and inventions; Renewable energy resources; China; Financial inclusions; Green finance; Panel causality; Panel cointegration; Policy recommendations; Renewable energies; Renewable energy source; Sustainability goal; Technological innovation; Sustainable development; alternative energy; energy efficiency; energy policy; green economy; innovation; investment; Sustainable Development Goal","","","","","","","","Article","Final","","Scopus","2-s2.0-85130581818"
"Yu, J.; Saydaliev, H.B.; Liu, Z.; Nazar, R.; Ali, S.","Yu, Jinna (55834919800); Saydaliev, Hayot Berk (57221252482); Liu, Zhen (59562843300); Nazar, Raima (57216249259); Ali, Sajid (57214290499)","55834919800; 57221252482; 59562843300; 57216249259; 57214290499","The asymmetric nexus of solar energy and environmental quality: Evidence from Top-10 solar energy-consuming countries","2022","Energy","247","","123381","","","23","10.1016/j.energy.2022.123381","https://www.scopus.com/inward/record.uri?eid=2-s2.0-85125697893&doi=10.1016%2Fj.energy.2022.123381&partnerID=40&md5=37d1427c639dbfbe800ef55fb921fb51","School of Political and Economic Management, Guizhou Minzu University, Guiyang, Guizhou, China; Associate Professor, SDU University, Kaskelen, Almaty, Kazakhstan; School of Business, Nanjing Normal University, Nanjing, Jiangsu, China; Department of Economics, The Women University Multan, Multhan, Punjab, Pakistan; School of Economics, Bahauddin Zakariya University, Multan, Punjab, Pakistan","Yu, Jinna, School of Political and Economic Management, Guizhou Minzu University, Guiyang, Guizhou, China; Saydaliev, Hayot Berk, Associate Professor, SDU University, Kaskelen, Almaty, Kazakhstan; Liu, Zhen, School of Business, Nanjing Normal University, Nanjing, Jiangsu, China; Nazar, Raima, Department of Economics, The Women University Multan, Multhan, Punjab, Pakistan; Ali, Sajid, School of Economics, Bahauddin Zakariya University, Multan, Punjab, Pakistan","Solar energy is one of the least carbon-intensive techniques of generating electricity in an increasingly carbon-constrained world. Solar energy emits no emissions during power production, and life-cycle assessments indicate that it has a lower carbon footprint than fossil fuels. The study explores the asymmetric relationship between solar energy production and environmental quality in the top-10 solar energy-consumer countries (China, USA, Germany, Japan, Italy, Australia, India, Spain, United Kingdom, and France). A new technique, ‘Quantile-on-Quantile (QQ)’, is used by taking the panel data from 1996 to 2018. Carbon footprint is taken as a proxy for environmental quality. The findings investigate how solar energy quantiles impact quantiles of carbon footprint asymmetrically by offering a suitable framework for understanding the overall dependency pattern. The empirical findings show that, with the exception of India and Spain, solar energy production improves environmental quality by minimizing carbon footprint at various quantiles. Furthermore, the findings indicate that the degree of the asymmetrical link in the solar energy-environmental quality association varies by country, implying that governments must exercise individual attention and precaution when developing policies related to solar energy and environmental quality. © 2022 Elsevier Ltd","Carbon footprint; Environmental quality; QQ estimation; Solar energy production","Electric power generation; Emission control; Fossil fuels; Life cycle; Solar energy; Energy productions; Energy quality; Environmental quality; Low carbon; NO emissions; Power production; Production quality; Quantile estimation; Quantile-on-quantile estimation; Solar energy production; Carbon footprint; carbon footprint; energy use; environmental quality; solar power; Australia; China; France; Germany; India; Italy; Japan; Spain; United Kingdom; United States","","","","","","","","Article","Final","","Scopus","2-s2.0-85125697893"
