"Автор (ы)","Author full names","Идентификатор автора(ов)","Название документа","Год","Название источника","Том","Выпуск","Статья №","Страница начала","Страница окончания","Цитирования","DOI","Ссылка","Организации","Авторы организаций","Краткое описание","Ключевые слова автора","Ключевые слова указателя","Сведения о финансировании","Текст о финансировании","Спонсоры","Название конференции","Дата конференции","Место проведения конференции","Код конференции","Тип документа","СТАДИЯ ПУБЛИКАЦИИ","Open Access (открытый доступ)","Источник","EID"
"Mussatayev, M.; Kempka, R.; Tomlinson, K.; Lewis, R.; Smagulova, D.; Rysbayeva, G.; Tuyenbayev, M.; Adenipekun, O.A.","Mussatayev, Meirbek (57219205441); Kempka, Ruby (59383965100); Tomlinson, Katherine (57222021569); Lewis, R. A. (10341445800); Smagulova, Damira (57205187144); Rysbayeva, Gulsim (57697959900); Tuyenbayev, Manat K. (59092622100); Adenipekun, Oluwatamilore A. (60172709400)","57219205441; 59383965100; 57222021569; 10341445800; 57205187144; 57697959900; 59092622100; 60172709400","Design and real-time sensitivity evaluation of directional eddy current probes on extracted rails","2026","Measurement: Journal of the International Measurement Confederation","259","","119611","","","0","10.1016/j.measurement.2025.119611","https://www.scopus.com/inward/record.uri?eid=2-s2.0-105021088166&doi=10.1016%2Fj.measurement.2025.119611&partnerID=40&md5=fb1c31badce2594a60af4b002177fdb1","Electronic and Mechanical Engineering, University of Bristol, Bristol, United Kingdom; Kazakhstan Institute of Non-Destructive Evaluation LLP, Astana, Kazakhstan; Mukhametzhan Tynyshbayev ALT University, Almaty, Kazakhstan; Aerospace and Civil Engineering, The University of Sheffield, Sheffield, South Yorkshire, United Kingdom; Department of Computer Science, SDU University, Kaskelen, Almaty, Kazakhstan","Mussatayev, Meirbek, Electronic and Mechanical Engineering, University of Bristol, Bristol, United Kingdom, Kazakhstan Institute of Non-Destructive Evaluation LLP, Astana, Kazakhstan, Mukhametzhan Tynyshbayev ALT University, Almaty, Kazakhstan; Kempka, Ruby, Aerospace and Civil Engineering, The University of Sheffield, Sheffield, South Yorkshire, United Kingdom; Tomlinson, Katherine, Aerospace and Civil Engineering, The University of Sheffield, Sheffield, South Yorkshire, United Kingdom; Lewis, R. A., Aerospace and Civil Engineering, The University of Sheffield, Sheffield, South Yorkshire, United Kingdom; Smagulova, Damira, Mukhametzhan Tynyshbayev ALT University, Almaty, Kazakhstan; Rysbayeva, Gulsim, Mukhametzhan Tynyshbayev ALT University, Almaty, Kazakhstan, Department of Computer Science, SDU University, Kaskelen, Almaty, Kazakhstan; Tuyenbayev, Manat K., Mukhametzhan Tynyshbayev ALT University, Almaty, Kazakhstan; Adenipekun, Oluwatamilore A., Aerospace and Civil Engineering, The University of Sheffield, Sheffield, South Yorkshire, United Kingdom","The occurrence of surface and sub-surface local damage, such as squats and studs, primarily attributed to rail-wheel contact within rail tracks, underscores the necessity for developing non-destructive testing methods. Such methods should ideally be high-speed, non-contact, and readily adaptable. Initial studies were undertaken to ascertain the optimal configurations of directional transmit and differential receiver eddy-current testing (ECT) sensors for detecting artificially induced rail defects. Discrepancies were observed in the response of the developed ECT sensors when compared to real rail damage. Consequently, this research evaluates the real-time efficacy of the original figure-8 transmit configuration with non-unity aspect ratio differential receivers against a novel dual figure-8 transmit design paired with unity aspect ratio receivers. The comparison focuses on their respective capabilities in detecting actual defects induced within rail steel samples, aiming to provide crucial insights for future in-line measurements using a trolley on a live rail network. ECT achieved a signal-to-noise ratio (SNR) exceeding 47 for rail studs, while μ-CT scans validated these results by confirming an approximate defect depth of 7.1 mm and width of 33.54 mm. Quantitative characterization was achieved through an evaluation of the SNR, indicating the desirability of lower frequencies for facilitating electronic data acquisition and processing. Additionally, lift-off sensitivity analysis demonstrated that the optimized probe design, operating at the optimum frequency, could detect targeted defects with up to a 10 mm lift-off distance, achieving an SNR of 5. © 2025 The Authors","Eddy current testing; Lift-off; Non-destructive testing; Probe optimization; Real-time inspection; Signal-to-noise ratio","Aspect ratio; Bridge decks; Data acquisition; Data handling; Defects; Eddy currents; Probes; Railroad transportation; Rails; Sensitivity analysis; Signal receivers; Structural analysis; Studs (structural members); Differential receivers; Eddy-current testing; Lift offs; Noise ratio; Non destructive testing; Optimisations; Probe optimization; Real- time; Realtime inspection; Signal to noise; Eddy current testing; Signal to noise ratio","University of Southampton; Ministry of Education and Science of the Republic of Kazakhstan, (AP26102347); Ministry of Education and Science of the Republic of Kazakhstan; Engineering and Physical Sciences Research Council, EPSRC, (EP/T02593X/1); Engineering and Physical Sciences Research Council, EPSRC","Funding text 1: This research has been/was/is funded by the Science Committee of the Ministry of Science and Higher Education of the Republic of Kazakhstan (Grant No. AP26102347). X-ray CT scanning was supported by the National Research Facility for Lab-based X-ray Computed Tomography (NXCT) at the \u03BC-VIS X-ray Imaging Centre, University of Southampton, through EPSRC grant [EP/T02593X/1]. The authors express their gratitude to Dr. Fernando Alvarez-Borges, Senior Research Fellow, \u03BC-VIS X-ray Imaging Centre, University of Southampton, for his invaluable assistance in the interpretation of the X-ray CT validation results.; Funding text 2: This research has been/was/is funded by the Science Committee of the Ministry of Science and Higher Education of the Republic of Kazakhstan (Grant No. AP26102347 ). X-ray CT scanning was supported by the National Research Facility for Lab-based X-ray Computed Tomography (NXCT) at the -VIS X-ray Imaging Centre, University of Southampton, through EPSRC grant [ EP/T02593X/1 ]. The authors express their gratitude to Dr. Fernando Alvarez-Borges, Senior Research Fellow, -VIS X-ray Imaging Centre, University of Southampton, for his invaluable assistance in the interpretation of the X-ray CT validation results.","","","","","","Article","Final","All Open Access; Green Accepted Open Access; Green Final Open Access; Green Open Access; Hybrid Gold Open Access","Scopus","2-s2.0-105021088166"
"Mussatayev, M.; Fakih, M.A.; Fitzgerald, M.; Lewis, R.; Beisenbekov, A.; Rysbayeva, G.; Rysbayev, B.","Mussatayev, Meirbek (57219205441); Fakih, Mohammad Ali H. (57195735890); Fitzgerald, Mark (58338369800); Lewis, R. A. (10341445800); Beisenbekov, Abay (59565820900); Rysbayeva, Gulsim (57697959900); Rysbayev, Berik (59565842400)","57219205441; 57195735890; 58338369800; 10341445800; 59565820900; 57697959900; 59565842400","Advanced real-time rail monitoring system based on directional eddy current probe","2026","NDT and E International","157","","103532","","","3","10.1016/j.ndteint.2025.103532","https://www.scopus.com/inward/record.uri?eid=2-s2.0-105014287481&doi=10.1016%2Fj.ndteint.2025.103532&partnerID=40&md5=02ad6aed9ab25cdd99f899a418fb9d5e","Electronic and Mechanical Engineering, University of Bristol, Bristol, United Kingdom; Mukhametzhan Tynyshbayev ALT University, Almaty, Kazakhstan; “Kazakhstan Institute of Non-Destructive Evaluation” LLP, Almaty, Kazakhstan; Electrical Workshop, University of Bristol, Bristol, United Kingdom; Aerospace and Civil Engineering, The University of Sheffield, Sheffield, South Yorkshire, United Kingdom; SCB at Almaty Alarm and Communication Distance of “Kazakhstan Temir Joly” JSC, Almaty, Kazakhstan; Department of Computer Science, SDU University, Kaskelen, Almaty, Kazakhstan","Mussatayev, Meirbek, Electronic and Mechanical Engineering, University of Bristol, Bristol, United Kingdom, Mukhametzhan Tynyshbayev ALT University, Almaty, Kazakhstan, “Kazakhstan Institute of Non-Destructive Evaluation” LLP, Almaty, Kazakhstan; Fakih, Mohammad Ali H., Electronic and Mechanical Engineering, University of Bristol, Bristol, United Kingdom; Fitzgerald, Mark, Electrical Workshop, University of Bristol, Bristol, United Kingdom; Lewis, R. A., Aerospace and Civil Engineering, The University of Sheffield, Sheffield, South Yorkshire, United Kingdom; Beisenbekov, Abay, Mukhametzhan Tynyshbayev ALT University, Almaty, Kazakhstan, SCB at Almaty Alarm and Communication Distance of “Kazakhstan Temir Joly” JSC, Almaty, Kazakhstan; Rysbayeva, Gulsim, Mukhametzhan Tynyshbayev ALT University, Almaty, Kazakhstan, Department of Computer Science, SDU University, Kaskelen, Almaty, Kazakhstan; Rysbayev, Berik, Mukhametzhan Tynyshbayev ALT University, Almaty, Kazakhstan, “Kazakhstan Institute of Non-Destructive Evaluation” LLP, Almaty, Kazakhstan","Increased train speeds and freight loads have contributed to the development of Rolling Contact Fatigue (RCF) and localized damage, such as studs and squats, at wheel-rail contact points. If left undetected, these defects can progress into shelling, where fluid penetration into fatigue cracks accelerates crack propagation and material separation or rail breaks. To address this issue and preserve rail integrity, a non-contact, high-speed, real-time directional eddy current probe for defect inspection has been developed. Initial laboratory testing of the portable prototype, conducted with studs exhibiting RCF-type defects, demonstrated successful detection at increasing speeds. The obtained eddy current results were further validated by ultrasonic testing (UT) to determine the depth profile. Finally, the signal-to-noise ratio (SNR) of the proposed system was estimated for a quantitative evaluation of inspection performance. Subsequent field tests were performed by integrating the technology with a Geismar TC Track Screwdriver on a section of R50 rail on track in the Almaty region of southern Kazakhstan. The system effectively identified spalling, indentations, and shelling defects, with a signal-to-noise ratio exceeding 4.5, showcasing its potential for reliable rail-defect inspection. © 2025 The Authors","Eddy current testing (ECT); In-line inspection; Non-destructive testing (NDT) method; Rail health monitoring system; Signal-to-noise ratio","Bridge decks; Eddy current testing; Eddy currents; Fatigue crack propagation; Fatigue damage; Inspection; Probes; Railroad transportation; Eddy current probes; Eddy-current testing; Health monitoring system; In-line inspections; Noise ratio; Nondestructive testing method; Rail health monitoring system; Real- time; Signal to noise; Ultrasonic testing","Suleyman Demirel University, SDU; University of Bristol; University of Sheffield; Ministry of Education and Science of the Republic of Kazakhstan, (AP26102347); Ministry of Education and Science of the Republic of Kazakhstan","Funding text 1: This research has been/was/is funded by the Science Committee of the Ministry of Science and Higher Education of the Republic of Kazakhstan (Grant No. AP26102347). I extend my sincere gratitude to my supervisors, Robert Hughes and Paul Wilcox, for their invaluable suggestions and guidance. Special thanks are due to R. Kempka and K. Tomlinson from Sheffield University, U.K. as well as S. Lewis from British Steel Limited, U.K. for their expert advice. Special thanks to Mr. Ian Chorley, a specialist technician at the Composites Manufacturing, Engineering Faculty Office at University of Bristol, for his assistance with the experimental setup of the Eagle S125 machine. Many thanks go to go to Dr Flora Hervin and Prof Paul Wilcox (University of Bristol) for assisting with the UT imaging and providing starting codes. Additionally, we extend our gratitude to Azamat Mukhtarov from SDU University, Kazakhstan, for his assistance in preparing the video demonstrators as supplementary materials. Meirbek Mussatayev also acknowledges the financial support provided by the Bolashak International Scholarship, Kazakhstan, which enabled my research in this field.; Funding text 2: This research has been/was/is funded by the Science Committee of the Ministry of Science and Higher Education of the Republic of Kazakhstan (Grant No. AP26102347 ). I extend my sincere gratitude to my supervisors, Robert Hughes and Paul Wilcox, for their invaluable suggestions and guidance. Special thanks are due to R. Kempka and K. Tomlinson from Sheffield University, U.K., as well as S. Lewis from British Steel Limited, U.K., for their expert advice. Special thanks to Mr. Ian Chorley, a specialist technician at the Composites Manufacturing, Engineering Faculty Office at University of Bristol, for his assistance with the experimental setup of the Eagle S125 machine. Many thanks go to go to Dr Flora Hervin and Prof Paul Wilcox (University of Bristol) for assisting with the UT imaging and providing starting codes. Additionally, we extend our gratitude to Azamat Mukhtarov from SDU University, Kazakhstan, for his assistance in preparing the video demonstrators as supplementary materials. Meirbek Mussatayev also acknowledges the financial support provided by the Bolashak International Scholarship, Kazakhstan , which enabled my research in this field.","","","","","","Article","Final","All Open Access; Green Final Open Access; Green Open Access; Hybrid Gold Open Access","Scopus","2-s2.0-105014287481"
"Meraliyev, M.; Turan, C.; Kadyrov, S.; Sadyk, U.","Meraliyev, Meraryslan A. (57207760258); Turan, Cemil (56246423000); Kadyrov, Shirali (36844229300); Sadyk, Ualikhan (57460291500)","57207760258; 56246423000; 36844229300; 57460291500","A Comprehensive Survey of Methods and Challenges of Vehicle Routing Problem with Uncertainties","2025","Mathematics","13","23","3782","","","1","10.3390/math13233782","https://www.scopus.com/inward/record.uri?eid=2-s2.0-105024580606&doi=10.3390%2Fmath13233782&partnerID=40&md5=9903d32458b520858867b20365eca882","Department of Computer Science, SDU University, Kaskelen, Almaty, Kazakhstan; Department of General Education, New Uzbekistan University, Tashkent, Uzbekistan","Meraliyev, Meraryslan A., Department of Computer Science, SDU University, Kaskelen, Almaty, Kazakhstan; Turan, Cemil, Department of Computer Science, SDU University, Kaskelen, Almaty, Kazakhstan; Kadyrov, Shirali, Department of General Education, New Uzbekistan University, Tashkent, Uzbekistan; Sadyk, Ualikhan, Department of Computer Science, SDU University, Kaskelen, Almaty, Kazakhstan","This paper presents a comprehensive survey of the methodologies and challenges associated with the Vehicle Routing Problem (VRP), focusing on the uncertainties that impact routing decisions in real-world logistics and transportation scenarios. Traditional VRP models often assume static and deterministic conditions, which do not fully capture the complexities of actual logistics operations. This paper categorizes uncertainties into demand variability, travel-time fluctuations, and other dynamic factors, such as service-time variability and vehicle breakdowns. It reviews various approaches to addressing these uncertainties, including dynamic VRP models and the application of reinforcement learning in stochastic environments. The research methodology includes a systematic review of articles published in recent years, emphasizing influential research at the intersection of VRP and uncertainty. The findings highlight the importance of bridging theoretical advances with practical applications to enhance the robustness and adaptability of VRP solutions. The paper concludes by advocating for continued research in this area to improve operational efficiency and service reliability in logistics. © 2025 by the authors.","demand variability; dynamic routing; reinforcement learning; transportation management; travel time variability; uncertainty; vehicle routing problem","","Ministry of Education and Science of the Republic of Kazakhstan, (AP19675614)","This research is funded by the Science Committee of the Ministry of Science and Higher Education of the Republic of Kazakhstan, Grant No. AP19675614.","","","","","","Review","Final","All Open Access; Gold Open Access; Green Accepted Open Access; Green Open Access","Scopus","2-s2.0-105024580606"
"Adilkhan, S.; Alimanova, M.; Shi, L.; Soltiyeva, A.","Adilkhan, Shyngys (57293085300); Alimanova, Madina U. (55938129800); Shi, Lei (55615905500); Soltiyeva, Aiganym (57994434700)","57293085300; 55938129800; 55615905500; 57994434700","Advances in artificial intelligence-driven 3D model generation: a review of GAN and VAE methodologies","2025","Bulletin of Electrical Engineering and Informatics","14","6","","4988","5011","0","10.11591/eei.v14i6.10755","https://www.scopus.com/inward/record.uri?eid=2-s2.0-105024093702&doi=10.11591%2Feei.v14i6.10755&partnerID=40&md5=974ef10c9d5c3f38002804871b89bd4d","Department of Information Systems, SDU University, Kaskelen, Almaty, Kazakhstan; Agriculture and Engineering, Newcastle University, Newcastle, Tyne and Wear, United Kingdom","Adilkhan, Shyngys, Department of Information Systems, SDU University, Kaskelen, Almaty, Kazakhstan; Alimanova, Madina U., Department of Information Systems, SDU University, Kaskelen, Almaty, Kazakhstan; Shi, Lei, Agriculture and Engineering, Newcastle University, Newcastle, Tyne and Wear, United Kingdom; Soltiyeva, Aiganym, Department of Information Systems, SDU University, Kaskelen, Almaty, Kazakhstan","This paper offers a comprehensive review of current developments in artificial intelligence (AI)-based 3D model creation, with an emphasis on techniques utilizing variational autoencoders (VAEs) and generative adversarial networks (GANs). 3DGAN, paired 3D model generation with GAN, conditional GAN, FaceVAE, voxel-based 3D object reconstruction, and 3D-VAE-SDFRaGAN are the six main techniques that are studied in this work. Each method is discussed, highlighting its architectural framework, data representation, and specific approach to generating 3D models. First, the paper introduces basic terms and classical 3D modeling techniques and provides a comparative analysis of them based on their workflow, purpose and field of application. In subsequent chapters, methods for generating 3D models based on the use of GANs and VAEs are reviewed, describing its methodology, experimentation technique, results, and comparison with other methods. The review outlines the strengths and limitations of each approach and their applications in object reconstruction, shape generation, and maintaining model consistency. It concludes by emphasizing how AI-driven methods can advance 3D modeling, underscoring the need for further research to enhance quality, control, and training reliability. The findings show AI’s significant impact on automating complex modeling tasks and enabling new creative opportunities in 3D content development. © 2025 Institute of Advanced Engineering and Science. All rights reserved.","3D model generation; 3D reconstruction; Artificial intelligence; Generative adversarial networks; Latent space; Polygon mesh; Variational autoencoder","","","","","","","","","Article","Final","All Open Access; Gold Open Access","Scopus","2-s2.0-105024093702"
"Altay, G.; Kucuksille, E.U.","Altay, Gönül (60012727500); Kucuksille, Ecir Ugur (18037773100)","60012727500; 18037773100","Quantum-Inspired Cross-Attention Alignment for Turkish Scientific Abstractive Summarization","2025","Electronics (Switzerland)","14","22","4474","","","1","10.3390/electronics14224474","https://www.scopus.com/inward/record.uri?eid=2-s2.0-105023146536&doi=10.3390%2Felectronics14224474&partnerID=40&md5=65cb0cfce17f937bcd3b2b6bc8e538f1","Department of Computer Engineering, SDU University, Kaskelen, Almaty, Kazakhstan","Altay, Gönül, Department of Computer Engineering, SDU University, Kaskelen, Almaty, Kazakhstan; Kucuksille, Ecir Ugur, Department of Computer Engineering, SDU University, Kaskelen, Almaty, Kazakhstan","This paper presents a quantum-inspired cross-attention alignment approach for abstractive summarization. The motivation is that current neural summarizers often lose key content and produce summaries that are weakly grounded in the source, especially for long and information-dense scientific articles in low-resource languages. The method itself is model-agnostic and aims to strengthen token-level alignment without introducing additional trainable parameters or inference overhead, by exploiting a Born-rule-based similarity between encoder and decoder states. This general idea is instantiated and tested on the task of summarizing Turkish scientific articles in Mathematics Education, which provides a challenging low-resource test bed with long and dense source texts. Six different fine-tuning variants built upon the mBART-50 model are examined, including SFT, LoRA baselines, and two novel quantum-augmented decoders: the parameter-free SFT + QDA + QKernel and SFT + QDA + QBorn (Born-rule-inspired, learnable classical mapping). Models are trained with five random seeds and evaluated using beam search and sampling schemes. Statistical significance is assessed via bootstrap confidence intervals, Benjamini–Hochberg FDR correction, and Cliff’s δ effect size. Beam search consistently outperforms sampling across all architectures. Our best configuration, SFT + QDA + QKernel, achieves strong results (ROUGE-L: 0.2966, BERTScore-F1: 0.8890) and yields statistically significant, large-effect gains over all baselines. These findings indicate that the proposed parameter-free quantum kernel provides a practical way to improve abstraction quality and faithfulness, particularly in low-resource summarization settings. © 2025 by the authors.","abstractive text summarization; attention alignment; born rule; low-rank adaptation (LoRA); mBART-50; quantum kernel; quantum-inspired learning; Turkish scientific articles","Abstracting; Alignment; Sampling; Abstractive text summarization; Attention alignment; Born rule; Low-rank adaptation; MBART-50; Quantum kernel; Quantum-inspired learning; Scientific articles; Text Summarisation; Turkish scientific article; Turkishs; Decoding","","","","","","","","Article","Final","All Open Access; Gold Open Access","Scopus","2-s2.0-105023146536"
