"Kosorukov, O.; Maslov, S.; Sviridova, O.; Bagisbayevc, K.","Kosorukov, Oleg Anatolievich (6603200715); Maslov, Sergey A. (56224389500); Sviridova, Olga Aleksandrovna (57208739165); Bagisbayevc, Karmak (57700034500)","6603200715; 56224389500; 57208739165; 57700034500","Models for Optimizing the Supply Volume in Conditions of Uncertainty in Demand, Taking into Account the Risks of Accrual of Penalties, Loss of Customers and Additional Costs","2022","Lecture Notes in Networks and Systems","387","","","249","259","0","10.1007/978-3-030-93872-7_21","https://www.scopus.com/inward/record.uri?eid=2-s2.0-85130417211&doi=10.1007%2F978-3-030-93872-7_21&partnerID=40&md5=ab9e70a0542ee61fd426fd1d86479f10","Lomonosov Moscow State University, Moscow, Moscow Oblast, Russian Federation; Financial University under the Government of the Russian Federation, Moscow, Russian Federation; SDU University, Kaskelen, Almaty, Kazakhstan","Kosorukov, Oleg Anatolievich, Lomonosov Moscow State University, Moscow, Moscow Oblast, Russian Federation; Maslov, Sergey A., Lomonosov Moscow State University, Moscow, Moscow Oblast, Russian Federation; Sviridova, Olga Aleksandrovna, Financial University under the Government of the Russian Federation, Moscow, Russian Federation; Bagisbayevc, Karmak, SDU University, Kaskelen, Almaty, Kazakhstan","The article describes stochastic optimization models of enterprise inventory management, taking into account the uncertainty of demand, which, according to most authors, is the main carrier of uncertainty in inventory management systems. As distribution laws describing this uncertainty, a triangular distribution is considered, which can be obtained in practice by expert assessment methods, for example, in the absence of a sufficient volume of statistical data. Formalization of the problems of finding the optimal delivery volume and their solution by analytical methods for goods of two types, namely, with a long shelf life and with a limited shelf life, are given. Four types of costs are taken into account, namely, storage costs (arising from the formation of unrealized surplus goods), costs of losing customers and calculating penalties (arising when it is impossible to fully meet the demand of a given period), as well as costs associated with the transportation, disposal or destruction of expired goods. which arise in the event of the formation of an unrealizable balance for goods with a limited shelf life. © 2022, The Author(s), under exclusive license to Springer Nature Switzerland AG.","Demand; Loss of customers; Penalties; Stocks; Storage; Utilization; Volume of supply","","","","","5th Scientific International Online Conference on Algorithms and Solutions Based on Computer Technology, ASBC 2021","2021-06-08 through 2021-06-09","Saint Petersburg","277479","Conference paper","Final","","Scopus","2-s2.0-85130417211"
"Omarov, B.; Narynov, S.; Zhumanov, Z.; Gumar, A.; Khassanova, M.","Omarov, Batyrkhan Sultanovich (57202103462); Narynov, Sergazy (56582431600); Zhumanov, Zhandos (55701348900); Gumar, Aidana (57292254400); Khassanova, Mariyam (57292944000)","57202103462; 56582431600; 55701348900; 57292254400; 57292944000","A Skeleton-based Approach for Campus Violence Detection","2022","Computers, Materials and Continua","72","1","","315","331","35","10.32604/cmc.2022.024566","https://www.scopus.com/inward/record.uri?eid=2-s2.0-85125880376&doi=10.32604%2Fcmc.2022.024566&partnerID=40&md5=d6d9d469127103719641b8548ccff707","Alem Research, Almaty, Kazakhstan; Al Farabi Kazakh National University, Almaty, Kazakhstan; International University of Tourism and Hospitality, Turkistan, Kazakhstan; SDU University, Kaskelen, Almaty, Kazakhstan; Asfendiyarov Kazakh National Medical University, Almaty, Kazakhstan","Omarov, Batyrkhan Sultanovich, Alem Research, Almaty, Kazakhstan, Al Farabi Kazakh National University, Almaty, Kazakhstan, International University of Tourism and Hospitality, Turkistan, Kazakhstan, SDU University, Kaskelen, Almaty, Kazakhstan; Narynov, Sergazy, Alem Research, Almaty, Kazakhstan; Zhumanov, Zhandos, Alem Research, Almaty, Kazakhstan, Al Farabi Kazakh National University, Almaty, Kazakhstan; Gumar, Aidana, Alem Research, Almaty, Kazakhstan, Asfendiyarov Kazakh National Medical University, Almaty, Kazakhstan; Khassanova, Mariyam, Alem Research, Almaty, Kazakhstan, Asfendiyarov Kazakh National Medical University, Almaty, Kazakhstan","In this paper, we propose a skeleton-based method to identify violence and aggressive behavior. The approach does not necessitate high-processing equipment and it can be quickly implemented. Our approach consists of two phases: feature extraction from image sequences to assess a human posture, followed by activity classification applying a neural network to identify whether the frames include aggressive situations and violence. A video violence dataset of 400 min comprising a single person’s activities and 20 h of video data including physical violence and aggressive acts, and 13 classifications for distinguishing aggressor and victim behavior were generated. Finally, the proposed method was trained and tested using the collected dataset. The results indicate the accuracy of 97% was achieved in identifying aggressive conduct in video sequences. Furthermore, the obtained results show that the proposed method can detect aggressive behavior and violence in a short period of time and is accessible for real-world applications. © 2022 Tech Science Press. All rights reserved.","Artificial intelligence; Bullying; Machine learning; PoseNET; Skeleton; Violence","Classification (of information); Machine learning; Musculoskeletal system; Bullying; Features extraction; Image sequence; Phase features; PoseNET; Processing equipment; Skeleton; Two phase; Violence; Violence detections; Video recording","Ministry of Education and Science of the Republic of Kazakhstan, (IRN AP08855520)","Funding Statement: This work was supported by the grant “Development of artificial intelligence-enabled software solution prototype for automatic detection of potential facts of physical bullying in educational institutions” funded by the Ministry of Education of the Republic of Kazakhstan. Grant No. IRN AP08855520.","","","","","","Article","Final","All Open Access; Gold Open Access","Scopus","2-s2.0-85125880376"
"Eriskin, E.; Terzi, S.; Ceylan, H.","Eriskin, E. (57039193000); Terzi, Serdal (9633494000); Ceylan, Halim (7004432706)","57039193000; 9633494000; 7004432706","Development of dynamic traffic signal control based on Monte Carlo simulation approach","2022","Measurement: Journal of the International Measurement Confederation","188","","110591","","","8","10.1016/j.measurement.2021.110591","https://www.scopus.com/inward/record.uri?eid=2-s2.0-85121217597&doi=10.1016%2Fj.measurement.2021.110591&partnerID=40&md5=1744e10aa16d9713792ed65f0973df57","Property Protection and Security Department, SDU University, Kaskelen, Almaty, Kazakhstan; Department of Civil Engineering, SDU University, Kaskelen, Almaty, Kazakhstan; Department of Civil Engineering, Pamukkale Üniversitesi, Denizli, Denizli, Turkey","Eriskin, E., Property Protection and Security Department, SDU University, Kaskelen, Almaty, Kazakhstan; Terzi, Serdal, Department of Civil Engineering, SDU University, Kaskelen, Almaty, Kazakhstan; Ceylan, Halim, Department of Civil Engineering, Pamukkale Üniversitesi, Denizli, Denizli, Turkey","This study addresses the maximum queue length problem arises when the arriving traffic exceeds the sensors’ detection area, especially for the over-saturated condition. The paper presents an adaptive system working Monte Carlo based Signal Timing (MCaST) algorithm based on microscopic scale vehicle arrival. Since the algorithm works as an adaptive system, two new mathematical formulas for the delay and queue length calculations have been proposed instead for fixed time formulas. Based on both queue length and intersection delay, the intersection performance has been calculated and used as a slave method to optimize the cycle length. The suggested MCaST algorithm has been tested using real field data, and the delay is decreased by 30.2% less during peak hour traffic. Besides, the delay results from the algorithm have been compared with Webster's and Highway Capacity Manual 2010 delay formulas and VISSIM software. Results of the numerical experiments show the MCaST algorithm's validity. © 2021","Adaptive signal control; Distribution; Monte-Carlo simulation; Queue; Statistic; VISSIM","Adaptive systems; Highway engineering; Intelligent systems; Monte Carlo methods; Traffic signals; Adaptive signal control; Distribution; Dynamic traffic signal control; Monte Carlo's simulation; Queue lengths; Saturated conditions; Signal timing; Simulation approach; Timing algorithms; VISSIM; Queueing theory","","This study is a part of Author’s (E. Eriskin) PhD Thesis and the authors would like to thank the OYP Coordination Unit of Suleyman Demirel University, Isparta, Turkey, for the financial support (Grant no OYP-5437-DR-14) and PTV Group: Traffic and Logistics Software and Technology Company for granting the thesis license for PTV VISSIM software. The authors thank Professor Serhan Tanyel, Professor Soner Haldenbilen, Professor Mehmet Saltan and Professor Hüseyin Ceylan for their valuable comments on the development of this study.","","","","","","Article","Final","","Scopus","2-s2.0-85121217597"
"Kangozhin, B.R.; Baimuratov, O.A.; Zharmagambetova, M.S.; Dautov, S.S.; Kangozhin, D.B.","Kangozhin, B. R. (57368321600); Baimuratov, Olimzhon (55832104800); Zharmagambetova, M. S. (57368109100); Dautov, S. S. (57367698000); Kangozhin, D. B. (57367072100)","57368321600; 55832104800; 57368109100; 57367698000; 57367072100","Noise Immunity of Devices of Automated Systems for Technological Control of Energy Facilities in the Almaty Region","2022","Studies in Systems, Decision and Control","399","","","277","290","1","10.1007/978-3-030-87675-3_17","https://www.scopus.com/inward/record.uri?eid=2-s2.0-85120889327&doi=10.1007%2F978-3-030-87675-3_17&partnerID=40&md5=8e9cbac71ec381cf8a95e4c2bcc8850e","Al Farabi Kazakh National University, Almaty, Kazakhstan; SDU University, Kaskelen, Almaty, Kazakhstan; Mukhametzhan Tynyshbayev ALT University, Almaty, Kazakhstan; JSC “NC” Kazakhstan Garysh Sapary”, Nur-Sultan, Kazakhstan","Kangozhin, B. R., Al Farabi Kazakh National University, Almaty, Kazakhstan; Baimuratov, Olimzhon, SDU University, Kaskelen, Almaty, Kazakhstan; Zharmagambetova, M. S., Al Farabi Kazakh National University, Almaty, Kazakhstan, SDU University, Kaskelen, Almaty, Kazakhstan, Mukhametzhan Tynyshbayev ALT University, Almaty, Kazakhstan; Dautov, S. S., Mukhametzhan Tynyshbayev ALT University, Almaty, Kazakhstan; Kangozhin, D. B., JSC “NC” Kazakhstan Garysh Sapary”, Nur-Sultan, Kazakhstan","The article presents the results of a study of the noise immunity of devices and elements of automated systems for technological control of energy facilities, associated with the use of relay cables. The analysis of the data obtained in this study is based on theoretical research methods, and the computational and experimental method were applied to determine the level of pulsed electromagnetic interference at 220 kV Taldykurgan, Stroitelnaya (Construction), Sary-Ozek, Zavodskaya and SS-220 “Shu” substations. All energy facilities considered in this article are located in the Almaty region. The influence of shielding cables on the level of electromagnetic influences on devices and elements of the automation system is revealed. It has been experimentally established that impulse noise in some relay circuits exceeds the permissible values during short-circuit and switching in the electrical network. The actual screening factors of control cables in operational conditions are determined. © 2022, The Author(s), under exclusive license to Springer Nature Switzerland AG.","Aggregated interference; Automated process of control systems; Electrical substation; Electromagnetic compatibility; Electromagnetic environment; Electromagnetic interference; Grounding device; Radiated pulse interference; Relay protection and automation","","","","","","","","","Book chapter","Final","","Scopus","2-s2.0-85120889327"
"Clipa, O.; Balta, N.; Mâţǎ, L.","Clipa, Otilia (37063026000); Balta, Nuri (56577982000); Mâţǎ, Liliana (37063353100)","37063026000; 56577982000; 37063353100","Investigating the Relationship Between Internet Ethics and Motivational Orientations in Higher Education","2022","EAI/Springer Innovations in Communication and Computing","","","","65","81","2","10.1007/978-981-16-1951-9_5","https://www.scopus.com/inward/record.uri?eid=2-s2.0-85111898828&doi=10.1007%2F978-981-16-1951-9_5&partnerID=40&md5=91aa8c1e2609f3919147ff6bfa4f6617","Universitatea Stefan cel Mare din Suceava, Suceava, Romania; SDU University, Kaskelen, Almaty, Kazakhstan; Universitatea din Bacau, Bacu, Bacau, Romania","Clipa, Otilia, Universitatea Stefan cel Mare din Suceava, Suceava, Romania; Balta, Nuri, SDU University, Kaskelen, Almaty, Kazakhstan; Mâţǎ, Liliana, Universitatea din Bacau, Bacu, Bacau, Romania","The study aimed to investigate the correlation between the students’ type of motivation (extrinsic/intrinsic) and their attitude toward the ethics of the use of information technologies, as well as the individual differences in students’ unethical Internet use concerning intrinsic and extrinsic motivational orientations. There was used the Internet-triggered Academic Dishonesty Scale to measure unethical behavior and the Work Preference Inventory to determine motivational orientations for university students. The results of this study indicate significant relationships between the motivational orientation factors and the Internet-triggered academic dishonesty behaviors. There are positive correlations between the dimensions of extrinsic motivation and the dimensions of unethical Internet use (reward and falsification, reward and misuse, recognition). As far as intrinsic motivation is concerned, there is only one positive correlation between pleasure and fraudulence. Depending on age, the research result shows that younger students are more prone to unethical behaviors on the Internet than older students. The study is expected to provide a significant contribution to the understanding of ethical Internet behaviors and to generate appropriate mechanisms for education and awareness of these issues by students and professors from higher education. © 2022, The Author(s), under exclusive license to Springer Nature Singapore Pte Ltd.","Internet ethics; Motivational orientations; Students","Motivation; Philosophical aspects; Academic dishonesty; Extrinsic motivation; Individual Differences; Internet behaviors; Intrinsic motivation; Motivational orientation; Positive correlations; University students; Students","Corporation for National and Community Service, CNCS; Unitatea Executiva pentru Finantarea Invatamantului Superior, a Cercetarii, Dezvoltarii si Inovarii, UEFISCDI, (PN-III-P1-1.1-TE-2016-0773); Ontario Ministry of Research and Innovation, MRI","Funding text 1: Acknowledgements “This work was supported by a grant of Ministry of Research and Innovation, CNCS—UEFISCDI, project number PN-III-P1-1.1-TE-2016-0773, within PNCDI III.”; Funding text 2: ?This work was supported by a grant of Ministry of Research and Innovation, CNCS?UEFISCDI, project number PN-III-P1-1.1-TE-2016-0773, within PNCDI III.?","","","","","","Book chapter","Final","","Scopus","2-s2.0-85111898828"
"Kadyrov, S.; Kashkynbayev, A.; Skrzypacz, P.; Kaloudis, K.; Bountis, A.","Kadyrov, Shirali (36844229300); Kashkynbayev, Ardak (55987699800); Skrzypacz, Piotr Sebastian (22235849900); Kaloudis, Konstantinos (57194701175); Bountis, Anastasios (57201375915)","36844229300; 55987699800; 22235849900; 57194701175; 57201375915","Periodic solutions and the avoidance of pull-in instability in nonautonomous microelectromechanical systems","2021","Mathematical Methods in the Applied Sciences","44","18","","14556","14568","5","10.1002/mma.7725","https://www.scopus.com/inward/record.uri?eid=2-s2.0-85112786008&doi=10.1002%2Fmma.7725&partnerID=40&md5=b30a31f007459ed13746b9aecb41c442","SDU University, Kaskelen, Almaty, Kazakhstan; School of Sciences and Humanities, Nazarbayev University, Astana, Kazakhstan; Department of Mechanical and Aerospace Engineering, Nazarbayev University, Astana, Kazakhstan; Department of Mathematics, University of Patras, Rio, Achaia, Greece","Kadyrov, Shirali, SDU University, Kaskelen, Almaty, Kazakhstan; Kashkynbayev, Ardak, School of Sciences and Humanities, Nazarbayev University, Astana, Kazakhstan; Skrzypacz, Piotr Sebastian, School of Sciences and Humanities, Nazarbayev University, Astana, Kazakhstan; Kaloudis, Konstantinos, Department of Mechanical and Aerospace Engineering, Nazarbayev University, Astana, Kazakhstan; Bountis, Anastasios, Department of Mathematics, University of Patras, Rio, Achaia, Greece","We study periodic solutions of a one-degree of freedom microelectromechanical system (MEMS) with a parallel-plate capacitor under T-periodic electrostatic forcing. We obtain analytical results concerning the existence of T-periodic solutions of the problem in the case of arbitrary nonlinear restoring force, as well as when the moving plate is attached to a spring fabricated using graphene. We then demonstrate numerically on a T-periodic Poincaré map of the flow that these solutions are generally locally stable with large “islands” of initial conditions around them, within which the pull-in stability is completely avoided. We also demonstrate graphically on the Poincaré map that stable periodic solutions with higher period nT, n > 1 also exist, for wide parameter ranges, with large “islands” of bounded motion around them, within which all initial conditions avoid the pull-in instability, thus helping us significantly increase the domain of safe operation of these MEMS models. © 2021 John Wiley & Sons, Ltd.","dynamical systems; forced graphene oscillator; MEMS; pull-in","Degrees of freedom (mechanics); MEMS; Analytical results; Initial conditions; Micro electromechanical system (MEMS); Nonlinear restoring force; Parallel plate capacitors; Pull-in instability; Pull-in stability; T-periodic solutions; Electromechanical devices","Ministry of Education and Science of the Republic of Kazakhstan, (2018‐2021, AP08051987); Nazarbayev University, NU, (090118FD5353)","SK acknowledges the support from a grant from the Ministry of Education and Science of the Republic of Kazakhstan within the framework of the Project AP08051987. KK acknowledges useful discussions with Professor Christos Spitas and partial support for this work by funds from the Ministry of Education and Science of Kazakhstan, in the context of the Nazarbayev University internal grant HYST (2018‐2021). AK was supported in part by Nazarbayev University FDCR Grants N 090118FD5353","","","","","","Article","Final","All Open Access; Green Accepted Open Access; Green Open Access","Scopus","2-s2.0-85112786008"
"Hasanov, A.S.; Mensi, W.; Oskenbayev, Y.","Hasanov, Akram Shavkatovich (56032794900); Mensi, Walid (55607222100); Oskenbayev, Yessengali (36091978400)","56032794900; 55607222100; 36091978400","Return and volatility spillovers between fossil oil and seafood commodity markets","2021","Energy-Growth Nexus in an Era of Globalization","","","","87","104","1","10.1016/B978-0-12-824440-1.00009-6","https://www.scopus.com/inward/record.uri?eid=2-s2.0-85127954281&doi=10.1016%2FB978-0-12-824440-1.00009-6&partnerID=40&md5=1778ffdb6734a5698581a1a08ce5ca29","Department of Econometrics and Business Statistics, Monash University Malaysia, Sunway City, Selangor, Malaysia; Department of Finance and Accounting, Université de Tunis El Manar, Tunis, Tunis, Tunisia; Department of Economics and Finance, Sultan Qaboos University, Muscat, Oman; School of Business, SDU University, Kaskelen, Almaty, Kazakhstan; Department of Finance and Accounting, University of International Business, Almaty, Kazakhstan","Hasanov, Akram Shavkatovich, Department of Econometrics and Business Statistics, Monash University Malaysia, Sunway City, Selangor, Malaysia; Mensi, Walid, Department of Finance and Accounting, Université de Tunis El Manar, Tunis, Tunis, Tunisia, Department of Economics and Finance, Sultan Qaboos University, Muscat, Oman; Oskenbayev, Yessengali, School of Business, SDU University, Kaskelen, Almaty, Kazakhstan, Department of Finance and Accounting, University of International Business, Almaty, Kazakhstan","This paper examines the return and volatility transmission between the fossil oil market and two mostly traded seafood commodity markets of salmon and shrimp. A unique feature of these markets is that biofuel feedstocks are used as essential feed ingredients in seafood production. The empirical analysis relies on a relatively new econometric method which exploits a bivariate version of nondiagonal GARCH model that allows for an asymmetry in the variance-covariance matrix. This study considers a multivariate t distribution in the maximum likelihood estimations by taking into account the tail properties of returns. The results identify significant price change and volatility transmissions from fossil oil markets to salmon markets. In contrast, the information transmission from crude oil price returns to shrimp price changes appears to be more prevalent than the variance transmission. © 2022 Elsevier Inc. All rights reserved.","Asymmetric multivariate GARCH model; Energy oil market; Q11 Q22 Q49; Return and variance transmissions; Seafood commodities; Spillover effects","","","","","","","","","Book chapter","Final","","Scopus","2-s2.0-85127954281"
"Japashov, N.M.; Mansurova, A.A.; Balta, N.","Japashov, Nursultan M. (59549248700); Mansurova, Aizhan A. (57196373400); Balta, Nuri (56577982000)","59549248700; 57196373400; 56577982000","CREATING A MICROGREEN GROWING ENVIRONMENT AT THE SPACE STATION; СТВОРЕННЯ СЕРЕДОВИЩА ДЛЯ ВИРОЩУВАННЯ МИКРОЗЕЛЕНІ НА КОСМІЧНІЙ СТАНЦІЇ","2021","Space Science and Technology","7","4","","65","73","1","10.15407/knit2021.04.065","https://www.scopus.com/inward/record.uri?eid=2-s2.0-85128115528&doi=10.15407%2Fknit2021.04.065&partnerID=40&md5=fea961e19f2a049f149e3b8051f9c769","Al Farabi Kazakh National University, Almaty, Kazakhstan; Nazarbayev Intellectual School of Chemistry and Biology, Almaty, Kazakhstan; Nazarbayev Intellectual School of Physics and Mathematics, Almaty, Kazakhstan; SDU University, Kaskelen, Almaty, Kazakhstan","Japashov, Nursultan M., Al Farabi Kazakh National University, Almaty, Kazakhstan, Nazarbayev Intellectual School of Chemistry and Biology, Almaty, Kazakhstan; Mansurova, Aizhan A., Al Farabi Kazakh National University, Almaty, Kazakhstan, Nazarbayev Intellectual School of Physics and Mathematics, Almaty, Kazakhstan; Balta, Nuri, SDU University, Kaskelen, Almaty, Kazakhstan","Plants are essential types of human nutrition, both in terrestrial and in space station conditions. The cultivation of plant foods in space conditions at the near-Earth stations has become possible due to the modern achievements in agricultural technologies. The proposed article aims to study the creation of optimal conditions for growing plants used in human nutrition in the space stations. In the work, a selection of plants and soil types for space station conditions was made. For this purpose, a three-stage experiment was carried out. In the first experiment, an experimental method was exploited to select the types of plants that are most suitable for growing under extreme conditions. The composition and structure of the soil were determined experimentally. It is shown that hydrogel can be used to accumulate water in space station conditions and can be a suitable medium for growing plants. Studies have shown that just hydrogel (without any nutrient mixtures) can promote plant growth. At the second stage of research, plants were successfully grown on the mixture of the hydrogel and the soil. In the third experiment, the authors added biostimulants and organic products to the hydrogel, and as a result, there was an increase in the speed and stability of plant growth. The experimental prototype of the container for growing plants in space conditions, which was tested in the above experiments, created by the authors, is shown. © 2021 Publishing House Akademperiodyka. All Rights Reserved.","hydrogel; microgreen; microgreen planting; planting in space station; planting microgreen in hydrogel","","","","","","","","","Article","Final","","Scopus","2-s2.0-85128115528"
