"Serek, A.; Zhaparov, M.; Yoo, S.-M.; Talasbek, A.; Kim, Y.K.; Jin, M.-W.","Serek, Azamat (57207763595); Zhaparov, M. K. (55637264200); Yoo, Seongmoo (7401970379); Talasbek, Assem (57207778433); Kim, Yongkab (35798501600); Jin, Minwoo (57217823518)","57207763595; 55637264200; 7401970379; 57207778433; 35798501600; 57217823518","Best Practices in Running IT Hackathons Based on Paragon University Dataset","2020","International Journal of Emerging Technologies in Learning","15","19","","231","238","5","10.3991/ijet.v15i19.15523","https://www.scopus.com/inward/record.uri?eid=2-s2.0-85097578858&doi=10.3991%2Fijet.v15i19.15523&partnerID=40&md5=d6797bcac283c1610ca761221c3ca685","SDU University, Kaskelen, Almaty, Kazakhstan; Paragon International University, Phnom Penh, Cambodia; The University of Alabama in Huntsville, Huntsville, AL, United States; Wonkwang University, Iksan, Jeollabuk-do, South Korea","Serek, Azamat, SDU University, Kaskelen, Almaty, Kazakhstan; Zhaparov, M. K., Paragon International University, Phnom Penh, Cambodia; Yoo, Seongmoo, The University of Alabama in Huntsville, Huntsville, AL, United States; Talasbek, Assem, SDU University, Kaskelen, Almaty, Kazakhstan; Kim, Yongkab, Wonkwang University, Iksan, Jeollabuk-do, South Korea; Jin, Minwoo, Wonkwang University, Iksan, Jeollabuk-do, South Korea","Hackathons are special activities, which normally last about 1-3 days with teams to present their innovative solutions to the given problems in the IT domain. In this paper, we report the Paragon IT hackathon developing a web application using Facebook API and our analysis of surveys from the hackathon participants. We list and analyze the statistics of participants as their gender, age, level of satisfaction, and the willingness of attending another hackathon. Then, we mention participants’ primary motivation to participate, things they learned from the hackathon, and the main challenges. Based on that, we make some recommendations how to improve this hackathon even better. The results can be extrapolated into other hackathons, especially in Asian countries. © 2020. All Rights Reserved.","data analysis; Facebook API; Hackathon; IT hackathon","Application programming interfaces (API); Asian countries; Best practices; Facebook; Innovative solutions; Level of satisfaction; WEB application; Surveys","","","","","","","","Article","Final","All Open Access; Gold Open Access; Green Accepted Open Access; Green Open Access","Scopus","2-s2.0-85097578858"
"Sapazhanov, Y.; Orynbassar, A.; Kadyrov, S.; Sydykhov, B.","Sapazhanov, Yershat (57204426334); Orynbassar, Alibek (57220763198); Kadyrov, Shirali (36844229300); Sydykhov, Bakhyt (57196956471)","57204426334; 57220763198; 36844229300; 57196956471","Factors Affecting Mathematics Achievement in Central Asian Specialized Universities","2020","International Journal of Emerging Technologies in Learning","15","19","","143","153","14","10.3991/ijet.v15i19.15629","https://www.scopus.com/inward/record.uri?eid=2-s2.0-85097577176&doi=10.3991%2Fijet.v15i19.15629&partnerID=40&md5=5f1971c04303825354a4ffb20787009b","SDU University, Kaskelen, Almaty, Kazakhstan","Sapazhanov, Yershat, SDU University, Kaskelen, Almaty, Kazakhstan; Orynbassar, Alibek, SDU University, Kaskelen, Almaty, Kazakhstan; Kadyrov, Shirali, SDU University, Kaskelen, Almaty, Kazakhstan; Sydykhov, Bakhyt, SDU University, Kaskelen, Almaty, Kazakhstan","This study examines variables explaining student's academic performances in mathematics from the specialized engineering institutions. A survey consisting of 42 items was conducted from 127 students and statistical multiple regression was carried out to analyze the data set. Based on Fennema-Sherman Mathematic Attitude Scales followed by the result of stepwise linear regression, found a significant impact of high school geometry grades in the mathematics performance. Authors suggest that mathematics instructors in higher education should pay attention to improve their student's confidence, which in turn would decrease the anxiety level towards mathematics. The high school teachers should not advise their students to go to technical sciences in higher education unless the student's confidence and high school math grade are sufficiently high. © 2020. All Rights Reserved.","Anxiety; confidence; correlations; education; stepwise regression; usefulness","Academic performance; Anxiety levels; Engineering institutions; High school teachers; Higher education; Multiple regressions; Stepwise linear regression; Technical science; Students","","","","","","","","Article","Final","All Open Access; Gold Open Access; Green Accepted Open Access; Green Open Access","Scopus","2-s2.0-85097577176"
"Tulemissova, G.; Baimuratov, O.A.","Tulemissova, Gulfarida (57188755654); Baimuratov, Olimzhon (55832104800)","57188755654; 55832104800","Cyber security system of FPGA platform for wireless sensor networks","2020","European Conference on Information Warfare and Security, ECCWS","2020-June","","","351","361","2","10.34190/EWS.20.051","https://www.scopus.com/inward/record.uri?eid=2-s2.0-85094667807&doi=10.34190%2FEWS.20.051&partnerID=40&md5=257adbfbe7601912994768599520b8f4","SDU University, Kaskelen, Almaty, Kazakhstan","Tulemissova, Gulfarida, SDU University, Kaskelen, Almaty, Kazakhstan; Baimuratov, Olimzhon, SDU University, Kaskelen, Almaty, Kazakhstan","This article hypothesizes that the presence of well-protected memory of sensor networks improves their performance as a multi-agent system. The agent’s memory stores information about typical reactions to information signals from receptors, as well as information about the state of effectors and available resources. It also stores programs for processing input information into control signals supplied to effectors and the results of reactions to a particular external situation, the number and variety of knowledge and programs stored in it, the degree of development of the internal model of the external world, and reflection options that determine the complexity and nature of behavior agent. The main components of the memory block are filter systems that provide the most important information for the agent, the internal model of the outside world, and the model of the agent itself. Purpose: to prove that using the FPGA platform guarantees programmable memory protection to maintain its level of autonomy and intelligence. The object of study: cybersecurity of sensor networks with protected memory Approaches: agent theory, machine learning Objective: To prove that the use of the FPGA platform guarantees programmable memory protection to maintain its level of autonomy and intelligence. Findings: sensor network security models. © 2020 Curran Associates Inc.. All rights reserved.","FPGA bit stream algorithms; clustering intrusion detection methods; Information security; Machine learning; Multi-agent system; Wireless sensor network (WSN)","Autonomous agents; Clustering algorithms; Cybersecurity; Field programmable gate arrays (FPGA); Intrusion detection; Machine learning; Multi agent systems; Network security; Bitstreams; Clustering intrusion detection method; Clusterings; Cyber security; FPGA bit stream algorithm;; Internal models; Intrusion detection method; Machine-learning; Sensors network; Wireless sensor network; Wireless sensor networks","","","","19th European Conference on Cyber Warfare and Security, ECCWS 2020","2020-06-25 through 2020-06-26","Virtual, Online","163901","Conference paper","Final","","Scopus","2-s2.0-85094667807"
"Talasbek, A.; Serek, A.; Zhaparov, M.; Yoo, S.-M.; Kim, Y.K.; Jeong, G.-H.","Talasbek, Assem (57207778433); Serek, Azamat (57207763595); Zhaparov, M. K. (55637264200); Yoo, Seongmoo (7401970379); Kim, Yongkab (35798501600); Jeong, Geun-ho (57208742592)","57207778433; 57207763595; 55637264200; 7401970379; 35798501600; 57208742592","Personality classification experiment by applying k-means clustering","2020","International Journal of Emerging Technologies in Learning","15","16","","162","177","18","10.3991/ijet.v15i16.15049","https://www.scopus.com/inward/record.uri?eid=2-s2.0-85090100474&doi=10.3991%2Fijet.v15i16.15049&partnerID=40&md5=72511c2a36278ea864c750ae57805ae6","SDU University, Kaskelen, Almaty, Kazakhstan; Paragon International University, Phnom Penh, Cambodia; The University of Alabama in Huntsville, Huntsville, AL, United States; Wonkwang University, Iksan, Jeollabuk-do, South Korea","Talasbek, Assem, SDU University, Kaskelen, Almaty, Kazakhstan; Serek, Azamat, SDU University, Kaskelen, Almaty, Kazakhstan; Zhaparov, M. K., Paragon International University, Phnom Penh, Cambodia; Yoo, Seongmoo, The University of Alabama in Huntsville, Huntsville, AL, United States; Kim, Yongkab, Wonkwang University, Iksan, Jeollabuk-do, South Korea; Jeong, Geun-ho, Wonkwang University, Iksan, Jeollabuk-do, South Korea","This paper describes personality classification experiment by applying k-means clustering machine learning algorithms. Several previous studies have been attempted to predict personality types of human beings automatically by using various machine learning algorithms. However, only few of them have obtained good accuracy results. To classify a person into personality types, we used Jungian Type Inventory. Our method consists of three parts: data collection, data preparation, and hyper-parameter tuning. Our testing results showed that the k-means model has 107 inertia value, which is a good number for an unsupervised learning model as an interim result. With the result, we divided the data into 16 clusters, which can be considered as personality types. We continue this research with analysis of large data to be collected in the future. © 2020, Kassel University Press GmbH.","Jungian type inventory; Kmeans clustering on personality test; Machine learning; Personality types","Data acquisition; K-means clustering; Machine learning; Data collection; Data preparation; Human being; Hyper-parameter; K-means; Large data; Personality types; Learning algorithms","","","","","","","","Article","Final","All Open Access; Gold Open Access; Green Accepted Open Access; Green Open Access","Scopus","2-s2.0-85090100474"
"Atymtayeva, L.; Kozhakhmet, K.; Savchenko, A.","Atymtayeva, Lyazzat (42061007500); Kozhakhmet, Kanat T. (54897934000); Savchenko, Alexander (57218266217)","42061007500; 54897934000; 57218266217","Automated system for monitoring of educational processes: collection, management, and modeling of data","2020","Lecture Notes in Business Information Processing","391 LNBIP","","","341","351","3","10.1007/978-3-030-52306-0_24","https://www.scopus.com/inward/record.uri?eid=2-s2.0-85088511833&doi=10.1007%2F978-3-030-52306-0_24&partnerID=40&md5=7966f84fa208ee3ba73eb8e0414b13ca","SDU University, Kaskelen, Almaty, Kazakhstan","Atymtayeva, Lyazzat, SDU University, Kaskelen, Almaty, Kazakhstan; Kozhakhmet, Kanat T., SDU University, Kaskelen, Almaty, Kazakhstan; Savchenko, Alexander, SDU University, Kaskelen, Almaty, Kazakhstan","Currently, the most of the processes at the educational analytical centers entirely depend on the human factor. Automation of the real-time monitoring system for the educational processes can be possible through the development and improvement of the information technologies, algorithms and computational methods, such as machine learning methods, analysis and visualization of big data processes. This paper covers the issues of the development of automated system for monitoring of educational processes from the point of view of data collection, data management, and data modeling. It includes the stages of data collection with the description of data engineering methods, data management procedures, algorithms of data cleaning and filtering, data modeling and visualization processes as well as the description of intelligent algorithms for scoring analysis of results. The principal feature that characterizes the development of the mentioned automated system is the using of availability of user experience data from existing educational sites and other open data sources that allow us to create a complete vision of the educational processes’ state at various levels. © Springer Nature Switzerland AG 2020.","Data collection; Data modeling; Education; Machine learning","Automation; Data acquisition; Data visualization; Information analysis; Machine learning; Monitoring; Open Data; Software design; User experience; Visualization; Analytical centers; Automated systems; Educational process; Intelligent Algorithms; Machine learning methods; Management procedures; Real time monitoring system; Visualization process; Information management","Süleyman Demirel Üniversitesi, SDÜ","This research was supported by grant of the program of Ministry of Education of the Republic of Kazakhstan BR05236699 Development of a digital adaptive educational environment using Big Data analytics. We thank our colleagues from Suleyman Demirel University (Kazakhstan) who provided insight and expertise that greatly assisted the research. We express our hopes that they will agree with the conclusions and findings of this paper.","","10th International Symposium on Business Modeling and Software Design, BMSD 2020","2020-07-06 through 2020-07-08","Berlin","242039","Conference paper","Final","","Scopus","2-s2.0-85088511833"
"Ashimova, A.; Yegorov, S.; Negmetzhanov, B.; Hortelano, G.","Ashimova, Assem (57212660992); Yegorov, Sergey (26434035900); Negmetzhanov, Baurzhan (57212651210); Hortelano, Gonzalo Hap (55962755000)","57212660992; 26434035900; 57212651210; 55962755000","Cell Encapsulation Within Alginate Microcapsules: Immunological Challenges and Outlook","2019","Frontiers in Bioengineering and Biotechnology","7","","380","","","116","10.3389/fbioe.2019.00380","https://www.scopus.com/inward/record.uri?eid=2-s2.0-85077290305&doi=10.3389%2Ffbioe.2019.00380&partnerID=40&md5=55964bb2b3021c56a08818423408dcbd","Department of Biology, Nazarbayev University, Astana, Kazakhstan; Department of Mathematics and Natural Sciences, SDU University, Kaskelen, Almaty, Kazakhstan; Center for Life Sciences, National Laboratory Astana, Astana, Kazakhstan","Ashimova, Assem, Department of Biology, Nazarbayev University, Astana, Kazakhstan; Yegorov, Sergey, Department of Biology, Nazarbayev University, Astana, Kazakhstan, Department of Mathematics and Natural Sciences, SDU University, Kaskelen, Almaty, Kazakhstan; Negmetzhanov, Baurzhan, Department of Biology, Nazarbayev University, Astana, Kazakhstan, Center for Life Sciences, National Laboratory Astana, Astana, Kazakhstan; Hortelano, Gonzalo Hap, Department of Biology, Nazarbayev University, Astana, Kazakhstan","Cell encapsulation is a bioengineering technology that provides live allogeneic or xenogeneic cells packaged in a semipermeable immune-isolating membrane for therapeutic applications. The concept of cell encapsulation was first proposed almost nine decades ago, however, and despite its potential, the technology has yet to deliver its promise. The few clinical trials based on cell encapsulation have not led to any licensed therapies. Progress in the field has been slow, in part due to the complexity of the technology, but also because of the difficulties encountered when trying to prevent the immune responses generated by the various microcapsule components, namely the polymer, the encapsulated cells, the therapeutic transgenes and the DNA vectors used to genetically engineer encapsulated cells. While the immune responses induced by polymers such as alginate can be minimized using highly purified materials, the need to cope with the immunogenicity of encapsulated cells is increasingly seen as key in preventing the immune rejection of microcapsules. The encapsulated cells are recognized by the host immune cells through a bidirectional exchange of immune mediators, which induce both the adaptive and innate immune responses against the engrafted capsules. The potential strategies to cope with the immunogenicity of encapsulated cells include the selective diffusion restriction of immune mediators through capsule pores and more recently inclusion in microcapsules of immune modulators such as CXCL12. Combining these strategies with the use of well-characterized cell lines harboring the immunomodulatory properties of stem cells should encourage the incorporation of cell encapsulation technology in state-of-the-art drug development. © Copyright © 2019 Ashimova, Yegorov, Negmetzhanov and Hortelano.","alginate; cell encapsulation; cytokines; damage-associated molecular patterns; immune response; microcapsule; therapeutic delivery","Alginate; Cell culture; Controlled drug delivery; Functional polymers; Genes; Immune system; Stem cells; Targeted drug delivery; Cell encapsulations; Cytokines; Immune response; Microcapsules; Molecular patterns; Therapeutic delivery; Microstructure","Oak Ridge Associated Universities, ORAU; Nazarbayev University, NU; (103527)","We would like to acknowledge the support of ORAU research funding to GH. AA receives NUIG graduate scholarship support from Nazarbayev University. The manuscript figure was created with BioRender.com.","","","","","","Review","Final","All Open Access; Gold Open Access; Green Accepted Open Access; Green Open Access","Scopus","2-s2.0-85077290305"
"Serek, A.; Issabek, A.; Bogdanchikov, A.","Serek, Azamat (57207763595); Issabek, Ainur (57207776383); Bogdanchikov, Andrey (57216432873)","57207763595; 57207776383; 57216432873","Distributed sentiment analysis of an agglutinative language via spark by applying machine learning methods","2019","2019 15th International Conference on Electronics, Computer and Computation, ICECCO 2019","","","9043264","","","6","10.1109/ICECCO48375.2019.9043264","https://www.scopus.com/inward/record.uri?eid=2-s2.0-85083523224&doi=10.1109%2FICECCO48375.2019.9043264&partnerID=40&md5=4dbd1403523c249db333d033f5fcbd20","Department of Computer Science, SDU University, Kaskelen, Almaty, Kazakhstan","Serek, Azamat, Department of Computer Science, SDU University, Kaskelen, Almaty, Kazakhstan; Issabek, Ainur, Department of Computer Science, SDU University, Kaskelen, Almaty, Kazakhstan; Bogdanchikov, Andrey, Department of Computer Science, SDU University, Kaskelen, Almaty, Kazakhstan","Currently there are a large amount of studies conducted on the field of sentiment analysis worldwide. Due to continuous drastic increase of amount of data, all natural language processing systems require special approach oriented to it. Implementing and evaluating such mechanism was a strong incentive to conduct this research. In this paper, sentiment analysis was implemented on Kazakh language via Spark on the basis of data set taken from Kazakh books. The data was initially unbalanced. There was achieved training F1 measure over 90 %. © 2019 IEEE.","Agglutinative language; Distributed sentiment analysis; Spark and machine learning; Spark in NLP","Learning algorithms; Machine learning; Agglutinative language; Data set; Large amounts; Machine learning methods; Sentiment analysis","","","","15th International Conference on Electronics, Computer and Computation, ICECCO 2019","2019-12-10 through 2019-12-12","Abuja","158814","Conference paper","Final","","Scopus","2-s2.0-85083523224"
"Bekbalanova, M.; Zhunis, A.; Duisebekov, Z.","Bekbalanova, Marzhan (57189333865); Zhunis, Aliya (57216436200); Duisebekov, Zhasdauren (57207774289)","57189333865; 57216436200; 57207774289","Epileptic Seizure Prediction in EEG Signals using EMD and DWT","2019","2019 15th International Conference on Electronics, Computer and Computation, ICECCO 2019","","","9043270","","","10","10.1109/ICECCO48375.2019.9043270","https://www.scopus.com/inward/record.uri?eid=2-s2.0-85083520254&doi=10.1109%2FICECCO48375.2019.9043270&partnerID=40&md5=b96a35edd35823674f235045da8044a6","Faculty of Engineering and Natural Sciences, SDU University, Kaskelen, Almaty, Kazakhstan; Department of Electronics and Communication Engineering, Kocaeli Üniversitesi, İzmit, Kocaeli, Turkey","Bekbalanova, Marzhan, Faculty of Engineering and Natural Sciences, SDU University, Kaskelen, Almaty, Kazakhstan; Zhunis, Aliya, Department of Electronics and Communication Engineering, Kocaeli Üniversitesi, İzmit, Kocaeli, Turkey; Duisebekov, Zhasdauren, Faculty of Engineering and Natural Sciences, SDU University, Kaskelen, Almaty, Kazakhstan","In this study, normal (healthy), pre-seizure and seizure states were analyzed using EEG data from BONN database. In this paper, we propose a new method of using SVM, KNN and Decision Tree for classification analysis in order to improve the detection accuracy of seizure. First, due to the presence of significant noise in the EEG signals, for signal pre-processing we performed noise removal. Second, two methods of frequency space transformation were used such as Discrete Wavelet Transform (DWT), separating signal into sub-bands and Empirical Mode Decomposition (EMD) technique to decompose signal into the Intrinsic Mode Functions (IMFs). Before the classification, the statistical moments of the signals in the frequency domain were obtained for feature extraction. Using these features, the performances of Support Vector Machines (SVM), Decision Tree, K-nearest Neighborhood (KNN) classifiers were analyzed. The experiment results show that the most accurate detection of epilepsy was obtained by applying EMD method with classifiers SVM, KNN and Decision Tree, and such algorithm with EMD can achieve accuracy for normal, pre-seizure, and seizure equal to 100%, 100% and 96.67%, respectively. © 2019 IEEE.","Decision Tree; DWT; EEG; EMD; KNN; Seizure Detection; SVM","Decision trees; Discrete wavelet transforms; Frequency domain analysis; Nearest neighbor search; Signal reconstruction; Support vector machines; Trees (mathematics); Wavelet decomposition; Classification analysis; Detection accuracy; Empirical Mode Decomposition; Epileptic seizure prediction; Frequency domains; Intrinsic Mode functions; K-nearest neighborhoods; Statistical moments; Biomedical signal processing","","","","15th International Conference on Electronics, Computer and Computation, ICECCO 2019","2019-12-10 through 2019-12-12","Abuja","158814","Conference paper","Final","","Scopus","2-s2.0-85083520254"
"Sultanova, N.; Kessikbayeva, G.; Amangeldi, Y.","Sultanova, Nazerke (57215220048); Kessikbayeva, Gulshat (57216431725); Amangeldi, Yerbolat (57205019329)","57215220048; 57216431725; 57205019329","Kazakh language open vocabulary language model with deep neural networks","2019","2019 15th International Conference on Electronics, Computer and Computation, ICECCO 2019","","","9043182","","","0","10.1109/ICECCO48375.2019.9043182","https://www.scopus.com/inward/record.uri?eid=2-s2.0-85083515346&doi=10.1109%2FICECCO48375.2019.9043182&partnerID=40&md5=cd8657c5e84d4073180815f7956890ef","Department of Computer Science, SDU University, Kaskelen, Almaty, Kazakhstan","Sultanova, Nazerke, Department of Computer Science, SDU University, Kaskelen, Almaty, Kazakhstan; Kessikbayeva, Gulshat, Department of Computer Science, SDU University, Kaskelen, Almaty, Kazakhstan; Amangeldi, Yerbolat, Department of Computer Science, SDU University, Kaskelen, Almaty, Kazakhstan","Natural Language models are a crucial tool in computational linguistics. They are specially difficult to build in agglutinative languages, which require attention since the words are formed by attaching sequences of different morphemes, where each morpheme can change the meaning of the word. For the mentioned type of language fixed and limited vocabulary itself can pose restrictions. The character-based solution may help to overcome the problem. However, it triggers the disambiguation of a word according to the context. The present work aims to build a character-based language model for the Kazakh Language, with the use of Deep Neural Networks, namely a Long Short-Term Memory model. The Language Model in the present research is generative and aims to produce all possible correct words within the context given. A word can be treated as a morpheme generated by characters where any possible word type could be generated. In order to understand the language model correctly, it is necessary to use data which was initially written in Kazakh and not translated from other sources. Therefore, the model will be trained using books written in Kazakh. © 2019 IEEE.","Deep neural networks; Language modeling; Natural language processing","Computational linguistics; Agglutinative language; Language model; Natural language model; Short term memory; Deep neural networks","","","","15th International Conference on Electronics, Computer and Computation, ICECCO 2019","2019-12-10 through 2019-12-12","Abuja","158814","Conference paper","Final","","Scopus","2-s2.0-85083515346"
