"Bogyrbayeva, A.; Meraliyev, M.; Mustakhov, T.; Dauletbayev, B.","Bogyrbayeva, Aigerim (57218692430); Meraliyev, Meraryslan A. (57207760258); Mustakhov, Taukekhan (57702321700); Dauletbayev, Bissenbay (57702057800)","57218692430; 57207760258; 57702321700; 57702057800","Machine Learning to Solve Vehicle Routing Problems: A Survey","2024","IEEE Transactions on Intelligent Transportation Systems","25","6","","4754","4772","84","10.1109/TITS.2023.3334976","https://www.scopus.com/inward/record.uri?eid=2-s2.0-85181555979&doi=10.1109%2FTITS.2023.3334976&partnerID=40&md5=a91a0b94754dda7ccfa11f4b1f24f723","Department of Computer Science, SDU University, Kaskelen, Almaty, Kazakhstan","Bogyrbayeva, Aigerim, Department of Computer Science, SDU University, Kaskelen, Almaty, Kazakhstan; Meraliyev, Meraryslan A., Department of Computer Science, SDU University, Kaskelen, Almaty, Kazakhstan; Mustakhov, Taukekhan, Department of Computer Science, SDU University, Kaskelen, Almaty, Kazakhstan; Dauletbayev, Bissenbay, Department of Computer Science, SDU University, Kaskelen, Almaty, Kazakhstan","This paper provides a systematic overview of machine learning methods applied to solve NP-hard Vehicle Routing Problems (VRPs). Recently, there has been great interest from both the machine learning and operations research communities in solving VRPs either through pure learning methods or by combining them with traditional handcrafted heuristics. We present a taxonomy of studies on learning paradigms, solution structures, underlying models, and algorithms. Detailed results of state-of-the-art methods are presented, demonstrating their competitiveness with traditional approaches. The survey highlights the advantages of the machine learning-based models that aim to exploit the symmetry of VRP solutions. The paper outlines future research directions to incorporate learning-based solutions to address the challenges of modern transportation systems. © 2000-2011 IEEE.","neural combinatorial optimization; Reinforcement learning; supervised learning; vehicle routing","Combinatorial optimization; Heuristic methods; Learning systems; Operations research; Supervised learning; Vehicles; Computational modelling; Machine learning methods; Machine learning research; Machine operation; Machine-learning; Neural combinatorial optimization; NP-hard; Reinforcement learnings; Routings; Vehicle Routing Problems; Vehicle routing","Ministry of Education and Science of the Republic of Kazakhstan, (IRN AP19575607); Ministry of Education and Science of the Republic of Kazakhstan","This work was supported by the funding for Young Scientists' Scientific and Technical Projects for 2023 2025, provided by the Ministry of Science and Higher Education of the Republic of Kazakhstan under Grant IRN AP19575607.","","","","","","Article","Final","","Scopus","2-s2.0-85181555979"
"Baimukashev, R.; Kadyrov, S.; Turan, C.","Baimukashev, Rashid (58414975800); Kadyrov, Shirali (36844229300); Turan, Cemil (56246423000)","58414975800; 36844229300; 56246423000","Systematic Survey of Deep Fuzzy Computer Vision in Biomedical Research","2024","Fuzzy Information and Engineering","16","3","","220","243","2","10.26599/FIE.2024.9270043","https://www.scopus.com/inward/record.uri?eid=2-s2.0-85210479085&doi=10.26599%2FFIE.2024.9270043&partnerID=40&md5=c388a78a6dc112d3e92e23a5b035461d","Department of Computer Science, SDU University, Kaskelen, Almaty, Kazakhstan; Department of General Education, New Uzbekistan University, Tashkent, Uzbekistan","Baimukashev, Rashid, Department of Computer Science, SDU University, Kaskelen, Almaty, Kazakhstan; Kadyrov, Shirali, Department of General Education, New Uzbekistan University, Tashkent, Uzbekistan; Turan, Cemil, Department of Computer Science, SDU University, Kaskelen, Almaty, Kazakhstan","This systematic survey explores the landscape of fuzzy computer vision techniques in biomedical research using articles from the Scopus database over the past decade. With a focus on methodologies, applications, and challenges, the survey aims to guide future research at the intersection of fuzzy logic and computer vision in biomedicine. Emphasizing applications such as dental image analysis and brain tumor detection, the paper showcases the collaborative potential of deep learning and fuzzy logic in enhancing biomedical image analysis. Despite notable advancements, challenges like model interpretability and scalability persist. The survey concludes by proposing future research directions, underscoring the pivotal role of fuzzy computer vision in advancing biomedical research. © 2009 Tsinghua University Press.","algorithm; artificial intellegence; biomedical research; deep learning; deep neural networks; fuzzy computer vision; image analysis","","Ministry of Education and Science of the Republic of Kazakhstan, (IRN AP19675614); Ministry of Education and Science of the Republic of Kazakhstan","This research was supported by the Science Committee of the Ministry of Science and Higher Education of the Republic of Kazakhstan (No. IRN AP19675614).","","","","","","Article","Final","All Open Access; Gold Open Access; Green Accepted Open Access; Green Open Access","Scopus","2-s2.0-85210479085"
"Kadyrov, S.; Aitzhanov, Y.; Shynarbek, N.","Kadyrov, Shirali (36844229300); Aitzhanov, Yerimbet (59257593900); Shynarbek, Nurdaulet (57459629800)","36844229300; 59257593900; 57459629800","Genetic Algorithm Approaches for Parameter Estimation and Global Stability in Fuzzy Epidemic Modeling","2024","Fuzzy Information and Engineering","16","2","","144","154","3","10.26599/FIE.2024.9270038","https://www.scopus.com/inward/record.uri?eid=2-s2.0-85201087426&doi=10.26599%2FFIE.2024.9270038&partnerID=40&md5=2d8afbead401b45512527ff51647cb68","Faculty of Science and Technology, Oxus University, Tashkent, Uzbekistan; Department of Mathematics and Natural Sciences, SDU University, Kaskelen, Almaty, Kazakhstan; Department of Science and Mathematics Education, SDU University, Kaskelen, Almaty, Kazakhstan","Kadyrov, Shirali, Faculty of Science and Technology, Oxus University, Tashkent, Uzbekistan; Aitzhanov, Yerimbet, Department of Mathematics and Natural Sciences, SDU University, Kaskelen, Almaty, Kazakhstan; Shynarbek, Nurdaulet, Department of Science and Mathematics Education, SDU University, Kaskelen, Almaty, Kazakhstan","This paper explores the synergy between fuzzy set theory and genetic algorithms in the domain of epidemic modeling, shedding light on the broader challenges inherent in infectious diseases. In response to the evolving landscape of epidemiology, the study advocates for sophisticated modeling techniques to better understand and predict dynamic scenarios. The research thoroughly investigates the global stability of equilibrium solutions within a fuzzy epidemic model, accompanied by an inventive parameter estimation methodology. Utilizing Lyapunov functions, the paper establishes global stability outcomes for both disease-free and endemic equilibria. The novel approach, integrating continued fraction theory and a genetic algorithm, is applied to fit real-world epidemic data, offering insights crucial for public health planning and control measures. By addressing unexplored facets and bridging gaps in previous research, the paper contributes to a more comprehensive understanding of epidemic dynamics, providing a foundation for effective public health strategies in the face of infectious diseases. © 2009 Tsinghua University Press.","continued fraction; epidemic modeling; fuzzy set theory; genetic algorithms; global stability analysis; Infected; Lyapunov functions; parameter estimation; Recovered (SIR) fuzzy model; Susceptible","","Ministry of Education and Science of the Republic of Kazakhstan, (AP19676669)","This work was supported by the Science Committee of the Ministry of Science and Higher Education of the Republic of Kazakhstan (No. AP19676669).","","","","","","Article","Final","All Open Access; Gold Open Access; Green Accepted Open Access; Green Open Access","Scopus","2-s2.0-85201087426"
"KHAZIMOV, K.; Sagyndykova, Z.; Khazimov, Z.; Daurenova, I.; Umbetkulov, Y.; Khazimov, M.","KHAZIMOV, Kanat M. (56469755000); Sagyndykova, Zh B. (57224165729); Khazimov, Z. M. (56469634800); Daurenova, Indira (59226221400); Umbetkulov, Yertugan (57205218595); Khazimov, M. Zh (55212169200)","56469755000; 57224165729; 56469634800; 59226221400; 57205218595; 55212169200","Thermal Welding in the Neck of Vacuum Flexible Container with Self-propelled Welding Module","2024","International Journal of Technology","15","4","","1088","1101","2","10.14716/ijtech.v15i4.6486","https://www.scopus.com/inward/record.uri?eid=2-s2.0-85199115213&doi=10.14716%2Fijtech.v15i4.6486&partnerID=40&md5=7738062dcf537b8451269812515cf7ae","Kazakh National Agrarian Research University, Almaty, Kazakhstan; Almaty University of Power Engineering and Telecommunications, Almaty, Almaty Province, Kazakhstan; Al Farabi Kazakh National University, Almaty, Kazakhstan; SDU University, Kaskelen, Almaty, Kazakhstan","KHAZIMOV, Kanat M., Kazakh National Agrarian Research University, Almaty, Kazakhstan, SDU University, Kaskelen, Almaty, Kazakhstan; Sagyndykova, Zh B., Kazakh National Agrarian Research University, Almaty, Kazakhstan, Almaty University of Power Engineering and Telecommunications, Almaty, Almaty Province, Kazakhstan; Khazimov, Z. M., Kazakh National Agrarian Research University, Almaty, Kazakhstan; Daurenova, Indira, Almaty University of Power Engineering and Telecommunications, Almaty, Almaty Province, Kazakhstan; Umbetkulov, Yertugan, Almaty University of Power Engineering and Telecommunications, Almaty, Almaty Province, Kazakhstan; Khazimov, M. Zh, Kazakh National Agrarian Research University, Almaty, Kazakhstan, Almaty University of Power Engineering and Telecommunications, Almaty, Almaty Province, Kazakhstan, Al Farabi Kazakh National University, Almaty, Kazakhstan","This study aimed to investigate the stability of weld seams in the neck of flexible containers made from polyethylene film for silage and storage of fresh ground corn mass as feed during thermal welding using a movable welding module. An analysis of the thermal conductivity of polyethylene film was conducted to determine temperature change pattern in the thin layer over time. The values obtained were used to establish optimal operating limits for the heating device during welding process. Subsequently, the resistance to rupture of the polyethylene film seams welded at different temperatures was evaluated by generating vacuum pressure in a specially designed installation. The results of polyethylene film PE-115 samples showed a pattern of limiting vacuum pressure values corresponding to different welding temperatures. The mathematical function obtained was used to identify the maximum value of the burst pressure of weld seams, which corresponded to 61.8 kPa at a temperature of 177oC. These results allowed for the determination of the optimal welding mode for sealing the container neck. © (2024), (International Journal of Technology). All rights reserved.","Ensiling; Flexible container; Polyethylene welded seams; Welding module","","Ministry of Education and Science of the Republic of Kazakhstan, (2022 -2024, AP13067761); Ministry of Education and Science of the Republic of Kazakhstan","This study was funded by the Committee of Science of the Ministry of Science and Higher Education of the Republic of Kazakhstan (Years for research grant are 2022 -2024. Grant No. AP13067761).","","","","","","Article","Final","All Open Access; Gold Open Access; Green Accepted Open Access; Green Open Access","Scopus","2-s2.0-85199115213"
"Kumar, A.; Ramachandran, M.; Manjula, M.; Agarwal, M.; Pooja; Kose, U.","Kumar, Ambeshwar B.Pradeep (57202315403); Ramachandran, Manikandan (37061393600); Manjula, M. (59063634400); Agarwal, Monika (57196261191); Pooja (59850850600); Kose, Utku (36544118500)","57202315403; 37061393600; 59063634400; 57196261191; 59850850600; 36544118500","Security, Privacy, Trust, and Other Issues in Industries 4.0","2024","Topics in Artificial Intelligence Applied to Industry 4.0","","","","223","237","2","10.1002/9781394216147.ch12","https://www.scopus.com/inward/record.uri?eid=2-s2.0-85192331206&doi=10.1002%2F9781394216147.ch12&partnerID=40&md5=36d646c6d3451de033b460f326934cd8","Gandhi Institute of Technology and Management (GITAM), Visakhapatnam, AP, India; School of Computing, SASTRA Deemed University, Thanjavur, TN, India; Dayananda Sagar University, Bengaluru, KA, India; SDU University, Kaskelen, Almaty, Kazakhstan","Kumar, Ambeshwar B.Pradeep, Gandhi Institute of Technology and Management (GITAM), Visakhapatnam, AP, India; Ramachandran, Manikandan, School of Computing, SASTRA Deemed University, Thanjavur, TN, India; Manjula, M., Dayananda Sagar University, Bengaluru, KA, India; Agarwal, Monika, Dayananda Sagar University, Bengaluru, KA, India; Pooja, null, Dayananda Sagar University, Bengaluru, KA, India; Kose, Utku, SDU University, Kaskelen, Almaty, Kazakhstan","In today’s global scenario, digitalization has reached a higher level. In the earlier era, only mobile phones and computers were connected to the internet, but with the advent of new technology such as surveillance cameras, biometric devices, automated vehicles, robots, and smart devices, nearly a billion devices are now connected to the internet, and by the year 2025, more than 50 billion devices would be connected with the internet. In this situation, security is the most concerning topic that whether the connected devices are safe or being attacked by unauthorized users. There is a lot to be gained by adopting Industry 4.0 technologies, so why has not adoption kept pace with expectations? The answer is simple: security. The industrial Internet of Things (IIoT) will have sensing, visualization, and analytics tools that can be accessed by anyone, anytime, anywhere in the world. However, the real challenges are not that machines are talking with each other. The main challenge is that people are interacting more and more through the machine and because of this the deeply rooted security problem with the possibility of impersonation, identity theft, hacking, and, in general, cyber-threats. Industry 4.0 fosters significant improvements to data exchange and industrial control in the manufacturing industry, as embodied in so-called smart factories. Manufacturing businesses need to make sure that IP assets, such as technical documentation and design files, are managed securely in addition to guaranteeing that the aforementioned responsibilities are completed. The Internet of Things (IoT) is a future-facing development of the Internet, where objects are communicating with each other. IoT devices will use sensor-based technologies, and they transmit the data from one device to another device or server. The gathered data is stored either in a cloud-based warehouse or a data warehouse. The challenges arise in the security of the gathered data; it should not be used by unauthorized or intruders. The resilience of production processes strongly depends on the manufacturing companies’ awareness of the current threat landscape and the employed security framework for protecting against attacks. Nearly 70% of most commonly used IoT devices contain vulnerabilities, which 56% unlikely or highly unlikely would be able to detect as a sophisticated attack by the organization. As IIoT is entering our day-to-day life, security risks are also pertaining to grow, and cyberattacks are no longer a matter of “what, when, if how, why.” Cybercriminals are also working on new technology to hack the disrupted sensitive data or damage the data. © 2024 John Wiley & Sons Ltd.","augmented reality; cyber-physical system; cyberterrorism; fog computing; IIoT; IoT attacks; phishing; security","","","","","","","","","Book chapter","Final","","Scopus","2-s2.0-85192331206"
"Farid, F.A.; Hashim, N.; Abdullah, J.B.; Bhuiyan, M.R.; Kairanbay, M.; Yusoff, Z.; Karim, H.A.; Mansor, S.; Sarker, M.D.T.; Ramasamy, G.","Farid, Fahmid Al (57288993100); Hashim, Noramiza Binti (25923471500); Abdullah, Junaidi Bin (17344939600); Bhuiyan, Md Roman (57289327500); Kairanbay, Magzhan Z. (57170931700); Yusoff, Zulfadzli Bin (6602570080); Karim, Hezerul Abdul (24492028400); Mansor, Sarina Binti (50761174000); Sarker, Md Tanjil (57816395100); Ramasamy, Gobbi (16022675600)","57288993100; 25923471500; 17344939600; 57289327500; 57170931700; 6602570080; 24492028400; 50761174000; 57816395100; 16022675600","Single Shot Detector CNN and Deep Dilated Masks for Vision-Based Hand Gesture Recognition From Video Sequences","2024","IEEE Access","12","","","28564","28574","20","10.1109/ACCESS.2024.3360857","https://www.scopus.com/inward/record.uri?eid=2-s2.0-85184333719&doi=10.1109%2FACCESS.2024.3360857&partnerID=40&md5=74bfe3b743642dcb1d03c5f361657ebb","Multimedia University, Cyberjaya, Selangor, Malaysia; Faculty of Computing and Informatics, Multimedia University, Cyberjaya, Selangor, Malaysia; Faculty of Engineering and Natural Sciences, SDU University, Kaskelen, Almaty, Kazakhstan","Farid, Fahmid Al, Multimedia University, Cyberjaya, Selangor, Malaysia; Hashim, Noramiza Binti, Faculty of Computing and Informatics, Multimedia University, Cyberjaya, Selangor, Malaysia; Abdullah, Junaidi Bin, Faculty of Computing and Informatics, Multimedia University, Cyberjaya, Selangor, Malaysia; Bhuiyan, Md Roman, Faculty of Computing and Informatics, Multimedia University, Cyberjaya, Selangor, Malaysia; Kairanbay, Magzhan Z., Faculty of Engineering and Natural Sciences, SDU University, Kaskelen, Almaty, Kazakhstan; Yusoff, Zulfadzli Bin, Multimedia University, Cyberjaya, Selangor, Malaysia; Karim, Hezerul Abdul, Multimedia University, Cyberjaya, Selangor, Malaysia; Mansor, Sarina Binti, Multimedia University, Cyberjaya, Selangor, Malaysia; Sarker, Md Tanjil, Multimedia University, Cyberjaya, Selangor, Malaysia; Ramasamy, Gobbi, Multimedia University, Cyberjaya, Selangor, Malaysia","With an increasing number of people on the planet today, innovative human-computer interaction technologies and approaches may be employed to assist individuals in leading more fulfilling lives. Gesture-based technology has the potential to improve the safety and well-being of impaired people, as well as the general population. Recognizing gestures from video streams is a difficult problem because of the large degree of variation in the characteristics of each motion across individuals. In this article, we propose applying deep learning methods to recognize automated hand gestures using RGB and depth data. To train neural networks to detect hand gestures, any of these forms of data may be utilized. Gesture-based interfaces are more natural, intuitive, and straightforward. Earlier study attempted to characterize hand motions in a number of contexts. Our technique is evaluated using a vision-based gesture recognition system. In our suggested technique, image collection starts with RGB video and depth information captured with the Kinect sensor and is followed by tracking the hand using a single shot detector Convolutional Neural Network (SSD-CNN). When the kernel is applied, it creates an output value at each of the m × n locations. Using a collection of convolutional filters, each new feature layer generates a defined set of gesture detection predictions. After that, we perform deep dilation to make the gesture in the image masks more visible. Finally, hand gestures have been detected using the well-known classification technique SVM. Using deep learning we recognize hand gestures with higher accuracy of 93.68% in RGB passage, 83.45% in the depth passage, and 90.61% in RGB-D conjunction on the SKIG dataset compared to the state-of-the-art. In the context of our own created Different Camera Orientation Gesture (DCOG) dataset we got higher accuracy of 92.78% in RGB passage, 79.55% in the depth passage, and 88.56% in RGB-D conjunction for the gestures collected in 0-degree angle. Moreover, the framework intends to use unique methodologies to construct a superior vision-based hand gesture recognition system. © 2013 IEEE.","deep dilated mask; Gesture recognition; SSD-CNN; SVM; video sequences","Convolution; Deep neural networks; Gesture recognition; Human computer interaction; Palmprint recognition; Video recording; Video streaming; Convolutional neural network; Deep dilated mask; Deep learning; Gestures recognition; Multimedia computing; Single shot detector convolutional neural network; Single-shot; Streaming medium; Support vectors machine; SVM; Video sequences; Support vector machines","Multimedia University, MMU, (MMUI/230023.02); Multimedia University, MMU","This work was supported by Multimedia University, Cyberjaya, Selangor, Malaysia, under Grant MMUI/230023.02.","","","","","","Article","Final","All Open Access; Gold Open Access; Green Accepted Open Access; Green Open Access","Scopus","2-s2.0-85184333719"
"Sohag, M.S.H.; Prabhu, S.; Omarov, B.; Kazakh, A.-F.; Sanjeev Kumar, R.S.; Natarajan, M.P.; Ramaiah, G.B.; Ramarao, M.","Sohag, Md Sabbir Hasan (57219989130); Prabhu, Sundramoorthy (57206541091); Omarov, Batyrkhan Sultanovich (57202103462); Kazakh, Al Farabi (57221463773); Sanjeev Kumar, Ramasamy (60151342700); Natarajan, M. P. (58555725000); Ramaiah, Gurumurthy B. (35270167100); Ramarao, Madhialagan (57193272923)","57219989130; 57206541091; 57202103462; 57221463773; 60151342700; 58555725000; 35270167100; 57193272923","Impact of Welding Temperature Regime on Hardness of Cr-Mo Steels","2023","International Journal of Vehicle Structures and Systems","15","5","","623","630","0","10.4273/ijvss.15.5.07","https://www.scopus.com/inward/record.uri?eid=2-s2.0-85182598411&doi=10.4273%2Fijvss.15.5.07&partnerID=40&md5=da1cd4e193ece2f08da3de94f81dff3a","Department of Electrical and Electronic Engineering, Bangladesh University of Business and Technology, Dhaka, Dhaka, Bangladesh; Department of Electrical and Electronic Engineering, Mohan Babu University, Tirupati, AP, India; International Information Technology University, Almaty, Kazakhstan; National University, Almaty, Kazakhstan; SDU University, Kaskelen, Almaty, Kazakhstan; Department of Mechanical Engineering, Swarnandhra College of Engineering and Technology, Narsapur, AP, India; Department of Mechanical Engineering, Bharath Institute of Higher Education and Research, Chennai, TN, India; FDRE Technical and Vocational Training Institute, Addis Ababa, Addis Ababa, Ethiopia","Sohag, Md Sabbir Hasan, Department of Electrical and Electronic Engineering, Bangladesh University of Business and Technology, Dhaka, Dhaka, Bangladesh; Prabhu, Sundramoorthy, Department of Electrical and Electronic Engineering, Mohan Babu University, Tirupati, AP, India; Omarov, Batyrkhan Sultanovich, International Information Technology University, Almaty, Kazakhstan; Kazakh, Al Farabi, National University, Almaty, Kazakhstan, SDU University, Kaskelen, Almaty, Kazakhstan; Sanjeev Kumar, Ramasamy, Department of Mechanical Engineering, Swarnandhra College of Engineering and Technology, Narsapur, AP, India; Natarajan, M. P., Department of Mechanical Engineering, Bharath Institute of Higher Education and Research, Chennai, TN, India; Ramaiah, Gurumurthy B., FDRE Technical and Vocational Training Institute, Addis Ababa, Addis Ababa, Ethiopia; Ramarao, Madhialagan, Department of Mechanical Engineering, Bharath Institute of Higher Education and Research, Chennai, TN, India","The aim of this work is to evaluate the effect of the welding temperature regime used on the resultant toughness of a welded joint in Cr-Mo steel. In the theoretical part of the thesis, attention is paid to the use and properties of Cr-Mo steels, in particular steel 15128 (14MoV6-3) and steel P91. Destructive and non-destructive hardness tests of welded joints and calculation methods have been discussed to predict the toughness in the heat affected zone of the welded joint. In the experimental part of the work, an experimental program was designed and implemented to control the stiffness of welded joints, depending on the temperature regime used. In addition, the functionality and accuracy of the calculation models selected for predicting the stiffness of welded joints are examined. © 2023. Carbon Magics Ltd.","Cr-Mo steels; Hardness; Steel 15128; Steel P91; Stiffness, Welded joints","Binary alloys; Chromium alloys; Chromium steel; Molybdenum alloys; Molybdenum steel; Nickel steel; Stiffness; Welded steel structures; Welding; CrMo steels; Experimental program; Heat-affected zones; Non destructive; Property; Steel 15128; Steel p91; Stiffness, welded joint; Temperature regimes; Welding temperatures; Heat affected zone","","","","","","","","Article","Final","All Open Access; Hybrid Gold Open Access","Scopus","2-s2.0-85182598411"
